{"decision_index":[{"decision_id":"clone-iphone-calculator-interaction","evidence_ids":["calculator-narrative","calculator-ui"],"section_id":"planning-background","status":"adopted"},{"decision_id":"limit-to-portrait-basic-operations","evidence_ids":["calculator-ui","calculator-engine"],"section_id":"planning-background","status":"adopted"},{"decision_id":"separate-engine-from-dom","evidence_ids":["calculator-engine","calculator-test"],"section_id":"engine-state","status":"adopted"},{"decision_id":"switch-between-ac-and-c","evidence_ids":["calculator-engine","calculator-test"],"section_id":"clear-state","status":"adopted"},{"decision_id":"replace-operator-and-repeat-equals","evidence_ids":["calculator-engine","calculator-test"],"section_id":"operator-behavior","status":"adopted"},{"decision_id":"define-error-and-percent","evidence_ids":["calculator-engine","calculator-test"],"section_id":"operator-behavior","status":"adopted"},{"decision_id":"preserve-mobile-keypad-contract","evidence_ids":["calculator-ui"],"section_id":"interface-contract","status":"adopted"}],"project_id":"260331-iphone-calculator-clone","readiness":"ready","sections":[{"body":"목표는 기능이 많은 계산기를 만드는 것이 아니라 iPhone 기본 계산기의 세로 화면과 핵심 4칙연산 상호작용을 웹에서 재현하는 것이었다. 공학 계산, 단위 변환과 기록 기능을 넣지 않고 숫자 입력, 연산 대기와 표시 상태가 일치하는지에 집중했다.\n\n외형 유사성만 맞추면 연속 연산과 clear 동작이 쉽게 어긋난다. 그래서 화면보다 먼저 계산 상태를 독립 엔진으로 분리하고 각 전이를 테스트할 수 있게 했다.\n","evidence_ids":["calculator-narrative","calculator-engine","calculator-ui"],"id":"planning-background","section_type":"planning","title":"일반 계산기가 아닌 상호작용 클론"},{"body":"표시 문자열과 버튼 class 안에 계산 규칙을 흩어 놓지 않고 엔진 객체가 현재 표시값, 대기 중 연산, 새 입력 대기, 직전 연산과 오류 상태를 소유한다. DOM은 사용자의 키 입력을 엔진에 전달하고 반환된 상태를 그리는 역할만 맡는다.\n\n이 분리로 브라우저 없이도 연속 연산과 오류를 검증할 수 있고, CSS를 바꿔도 계산 의미가 함께 바뀌지 않는다. 서버와 저장소는 필요하지 않은 정적 프로토타입이다.\n","evidence_ids":["calculator-engine","calculator-test"],"id":"engine-state","section_type":"decision","title":"계산 엔진을 DOM에서 분리"},{"body":"초기 상태와 계산 전체를 지워야 할 때는 AC를, 현재 입력만 지울 수 있을 때는 C를 보여 준다. 두 동작을 하나의 항상 같은 버튼으로 처리하면 사용자가 중간 계산을 보존할지 예측하기 어렵다.\n\n엔진 상태가 clear label과 실제 reset 범위를 함께 결정한다. 화면 문자열만 C로 바꾸고 내부 연산을 모두 지우는 불일치를 테스트로 막았다.\n","evidence_ids":["calculator-engine","calculator-test","calculator-ui"],"id":"clear-state","section_type":"decision","title":"입력 상태에 따른 AC와 C 전환"},{"body":"숫자 없이 연산자를 연속해서 누르면 계산을 실행하지 않고 마지막 연산자로 교체한다. equals를 다시 누르면 직전 연산과 피연산자를 재사용한다. 모바일 계산기에서 흔한 입력 수정과 반복 계산을 별도 명령 없이 지원하는 규칙이다.\n\n0으로 나누면 정상 숫자로 이어가지 않고 오류 상태로 전환한다. percent는 현재 값의 100분의 1로 정의했으며, iOS가 연산 맥락에 따라 보이는 모든 percent 의미를 완전히 복제했다고 주장하지 않는다.\n","evidence_ids":["calculator-engine","calculator-test"],"id":"operator-behavior","section_type":"decision","title":"연산자 교체와 반복 equals"},{"body":"0 버튼은 두 칸을 차지하고 선택된 연산자는 active 상태를 보인다. 긴 표시값은 버튼이나 화면 폭을 밀어내지 않도록 축소한다. display는 live 영역, keypad는 의미 있는 그룹으로 제공해 스크린 리더가 결과 변화를 인지할 기본 구조를 둔다.\n\n이 계약은 코드에 존재하지만 iPhone 16 Pro의 실제 viewport, safe area, 글꼴과 간격을 기준 이미지와 픽셀 단위로 비교하지 않았다. 유사한 구성과 픽셀 동등성은 다른 검증이다.\n","evidence_ids":["calculator-ui","calculator-narrative"],"id":"interface-contract","section_type":"decision","title":"세로 4칙연산 화면 유지"},{"body":"정적 HTML과 CSS가 display와 keypad를 만들고 브라우저 스크립트가 버튼 이벤트를 독립 calculator engine에 전달한다. 엔진은 다음 상태를 반환하고 화면은 표시값, clear label과 active operator를 갱신한다.\n\n네트워크와 저장소가 없어 재현 범위가 작고 테스트가 빠르다. 반면 키보드 입력, orientation과 모바일 브라우저 차이는 별도 이벤트 계약이 필요하다.\n","evidence_ids":["calculator-engine","calculator-ui"],"id":"implementation-flow","section_type":"implementation","title":"정적 UI와 상태 엔진 연결"},{"body":"현재 코드에서 덧셈, 뺄셈, 곱셈, 나눗셈, 소수, 부호, percent, 연산자 교체, 반복 equals, 0 나누기와 AC/C를 포함한 12개 Node 테스트가 통과했다. 이는 계산 엔진의 핵심 상태 전이를 직접 확인한 결과다.\n\n초기 handoff는 기준 화면과 픽셀 측정 자료가 없어 시각 동등성을 판정하지 못했다. 이후 코드가 생겼더라도 screenshot과 pixel comparison을 실행하지 않았으므로 외형까지 동일하다고 말하지 않는다.\n","evidence_ids":["calculator-test","calculator-narrative"],"id":"validation","section_type":"validation","title":"상태 전이 12개 테스트"},{"body":"실제 iPhone viewport와 safe area, 글꼴, 색과 간격 비교가 없다. 모바일 Safari, 회전, 키보드 입력과 VoiceOver도 실행하지 않았다. percent의 맥락별 세부 의미는 단순 규칙보다 복잡할 수 있다.\n\n이 프로젝트가 확인한 것은 핵심 4칙연산 상태와 화면 연결을 분리한 웹 프로토타입이다. iOS 앱이나 픽셀 단위 복제 완료를 의미하지 않는다.\n","evidence_ids":["calculator-narrative","calculator-ui"],"id":"limitations","section_type":"result","title":"시각과 실제 기기 검증의 공백"}],"summary":"iPhone 기본 계산기의 세로 4칙연산 흐름을 작은 상태 엔진으로 분리하고 AC와 C, 연산자 교체와 반복 계산을 테스트한 정적 상호작용 프로토타입을 정리한다.","title":"계산 상태를 분리한 iPhone 계산기 클론"}
