{"decision_index":[{"decision_id":"keep-model-calls-on-backend","evidence_ids":["polite-backend"],"section_id":"backend-boundary","status":"adopted"},{"decision_id":"use-google-oauth-only","evidence_ids":["polite-backend","polite-popup"],"section_id":"oauth-session","status":"revised"},{"decision_id":"poll-and-store-session-token","evidence_ids":["polite-popup","polite-backend"],"section_id":"oauth-session","status":"adopted"},{"decision_id":"enforce-usage-server-side","evidence_ids":["polite-backend"],"section_id":"backend-boundary","status":"adopted"},{"decision_id":"structure-rewrite-context","evidence_ids":["polite-popup","polite-backend"],"section_id":"rewrite-contract","status":"adopted"},{"decision_id":"replace-smtp-with-browser-mail","evidence_ids":["polite-docs","polite-narrative"],"section_id":"contact-email-rollback","status":"rolled-back"},{"decision_id":"persist-contact-before-delivery","evidence_ids":["polite-backend"],"section_id":"contact-email-rollback","status":"adopted"},{"decision_id":"use-sqlite-persistent-volume","evidence_ids":["polite-backend","polite-docs"],"section_id":"contact-email-rollback","status":"adopted"},{"decision_id":"keep-payment-disabled-by-default","evidence_ids":["polite-backend","polite-docs"],"section_id":"payment-boundary","status":"unresolved"},{"decision_id":"package-extension-only","evidence_ids":["polite-release","polite-narrative"],"section_id":"release-package","status":"revised"},{"decision_id":"narrow-host-permissions","evidence_ids":["polite-release"],"section_id":"release-package","status":"revised"},{"decision_id":"separate-cws-assets","evidence_ids":["polite-release"],"section_id":"release-package","status":"adopted"},{"decision_id":"align-policy-to-runtime-code","evidence_ids":["polite-backend","polite-docs"],"section_id":"backend-boundary","status":"unresolved"}],"project_id":"260322-polite-message-extension","readiness":"ready","sections":[{"body":"이 확장은 긴 문서 편집기보다 메신저나 메일을 보내기 직전에 문장을 다듬는 흐름을 목표로 했다. 사용자는 원문과 함께 수신자, 관계, 원하는 톤과 배경을 구조화해 넣고 한국어 또는 English 결과를 바로 복사한다.\n\n확장 안에서 모든 운영 기능을 처리하지 않고 로그인, 사용량 제한, 모델 호출과 문의 저장을 backend로 보냈다. 출시 패키지와 실제 스토어 공개판이 과거에 어긋난 이력이 있어, 저장소 자산과 현재 승인 상태를 구분한다.\n","evidence_ids":["polite-narrative","polite-popup","polite-backend"],"id":"planning-background","section_type":"planning","title":"발신 직전의 맥락을 짧게 입력"},{"body":"배포되는 확장에는 외부 모델 호출 권한을 넣지 않고 backend만 재작성 요청을 수행한다. 사용자가 직접 외부 설정을 제공하는 경로는 self-host 범위로 제한했다. 무료, Pro와 Business의 일별 또는 월별 요청, 문자와 token 제한도 클라이언트 표시가 아니라 서버에서 집행한다.\n\n이 경계는 제출 파일의 노출을 줄이고 제한 우회를 어렵게 하지만 backend 가용성과 정책 정합성에 의존한다. 코드와 문서, landing에 서로 다른 세대의 가격과 제한이 있어 공개 전에 한 실행 기준으로 맞춰야 한다.\n","evidence_ids":["polite-backend","polite-docs"],"id":"backend-boundary","section_type":"decision","title":"외부 호출과 사용량을 서버에서 관리"},{"body":"이메일 기반 자체 인증은 중단하고 Google OAuth만 지원한다. 이전 auth endpoint는 더 이상 사용하는 척 남기지 않고 종료 상태를 반환한다. 확장과 웹 브라우저의 cookie 공유가 안정적이지 않아 OAuth 완료를 polling하고 발급된 세션을 Chrome storage에 저장해 요청 header로 전달한다.\n\npolling 상태가 서버 메모리에 있어 재시작 중에는 완료 정보를 잃을 수 있다. 로그인 단순화와 재시작 내구성은 별개의 문제이며 durable pending state가 후속 과제다.\n","evidence_ids":["polite-popup","polite-backend","polite-docs"],"id":"oauth-session","section_type":"decision","title":"Google 로그인과 명시적 세션 전달"},{"body":"prompt는 수신자, 역할, 톤과 배경을 구조화해 만든다. 자유 설명 하나로 모든 조건을 추측하게 하지 않아 UI 입력과 서버 요청의 의미를 맞췄다. 출력 언어는 한국어와 English 두 가지로 한정하고 전면 다국어 확장은 제외했다.\n\n관계와 상황을 입력한다고 해서 항상 적절한 결과가 보장되는 것은 아니다. 민감한 내용의 최소 전송, 원문 보존 여부와 실제 품질 평가는 별도 운영 기준이 필요하다.\n","evidence_ids":["polite-popup","polite-backend"],"id":"rewrite-contract","section_type":"decision","title":"수신자와 톤을 구조화한 재작성"},{"body":"서버에서 Gmail SMTP로 문의를 보내는 방식이 반복 timeout된 뒤 브라우저 EmailJS로 전환했다. 먼저 문의를 backend 데이터베이스에 저장하고 브라우저가 메일을 전송한다. 메일 실패가 문의 원장까지 지우지 않도록 저장과 알림을 분리한 롤백이다.\n\n운영자는 저장된 문의를 조회하고 답장을 관리한다. SQLite와 영속 볼륨이 사용자, 사용량, 문의와 주문 상태의 원장이며 다중 인스턴스 확장은 해결되지 않았다.\n","evidence_ids":["polite-backend","polite-docs","polite-narrative"],"id":"contact-email-rollback","section_type":"decision","title":"문의 저장과 메일 발송 분리"},{"body":"외부 checkout 코드와 주문 테이블은 준비돼 있지만 feature flag의 기본은 off다. landing도 무료 사용을 우선하고 유료 기능을 준비 중으로 표시한다. 코드가 존재한다는 이유로 실제 결제가 활성화됐다고 쓰지 않는다.\n\n플랜 명칭과 한도 수치가 문서와 코드 사이에서 어긋나 있어 실행 기준을 먼저 정해야 한다. 주문 저장, 결제 callback, 환불과 사용자 권한 변경을 운영 환경에서 확인하기 전에는 유료 출시 성과가 아니다.\n","evidence_ids":["polite-backend","polite-docs"],"id":"payment-boundary","section_type":"decision","title":"결제 준비와 실제 활성 상태 분리"},{"body":"제출물은 현재 `extension` 내용만 release ZIP으로 만들고 루트에 남아 있던 오래된 ZIP은 기준에서 제외했다. 과거 패키지에는 오래된 UI, 과도한 권한과 불필요 파일이 있어 사용자가 기대한 버전과 실제 제출물이 달랐다.\n\nhost permission도 실제 운영 origin 하나로 좁히고 개발용 origin과 광범위 wildcard를 제출본에서 제거했다. 아이콘, screenshot과 promotion tile은 별도 CWS 자산으로 관리하지만 파일 존재가 승인이나 게시 완료를 뜻하지 않는다.\n","evidence_ids":["polite-release","polite-popup","polite-narrative"],"id":"release-package","section_type":"decision","title":"제출 ZIP과 권한 범위 정리"},{"body":"MV3 popup은 OAuth session과 사용자 설정을 Chrome storage에 보관하고 backend API로 재작성 요청을 보낸다. backend는 사용자, 사용량, 문의와 결제 주문을 SQLite에 저장하고 재작성과 메일 공급 경로를 선택한다.\n\n문의는 DB 저장 후 브라우저 메일 전송으로 이어지고, release script는 확장 디렉터리만 묶어 제출 후보를 만든다. 웹 landing, backend 운영과 스토어 패키지는 서로 다른 배포 단위다.\n","evidence_ids":["polite-popup","polite-backend","polite-release"],"id":"implementation-flow","section_type":"implementation","title":"popup에서 backend까지"},{"body":"현재 backend server와 prompt 모듈, extension popup의 JavaScript 문법을 확인했다. 과거 기록에는 최신 제출 ZIP 생성, manifest 권한 축소, release script와 문법 검사가 남아 있다.\n\nCWS 체크리스트는 미체크 template이고 승인 증거가 아니다. 과거 승인된 패키지가 다른 내용이었다는 사용자 보고도 있어, 실제 스토어 최신 버전과 권한, 개인정보 고지는 별도 확인이 필요하다.\n","evidence_ids":["polite-release","polite-narrative"],"id":"validation","section_type":"validation","title":"제출 후보와 실제 스토어의 차이"},{"body":"공개 소스에는 운영용 공개 식별자와 연락 기본값, 특정 사용자 우회 기본값이 있어 저장소 정책을 검토해야 한다. 가격과 제한 문서도 실행 코드와 일치하지 않는다. OAuth polling 재시작 내구성과 SQLite 다중 인스턴스도 남아 있다.\n\n실제 결제 활성, 최신 스토어 버전, 최소 권한과 개인정보 고지를 확인하지 않았다. 현재 성과는 상황 기반 재작성과 backend 운영 경계, 정리된 제출 후보까지이며 스토어 및 운영 배포 승인이 아니다.\n","evidence_ids":["polite-docs","polite-backend","polite-narrative"],"id":"limitations","section_type":"result","title":"정책 정합성과 운영 검증 과제"}],"summary":"수신자와 관계, 톤과 배경을 구조화해 문장을 재작성하고, 로그인과 사용량 제한, 문의와 제출 패키지를 서버 경계에서 운영한 Chrome 확장의 결정과 미확인 출시 상태를 정리한다.","title":"상황에 맞춰 문장을 다듬는 Chrome 확장"}
