{"decision_index":[{"decision_id":"use-fixed-friend-personas","evidence_ids":["friends-personas"],"section_id":"persona-and-entry","status":"adopted"},{"decision_id":"support-oauth-and-demo","evidence_ids":["friends-narrative"],"section_id":"persona-and-entry","status":"adopted"},{"decision_id":"split-chat-and-memory-models","evidence_ids":["friends-chat","friends-memory"],"section_id":"async-memory-boundary","status":"revised"},{"decision_id":"isolate-memory-failure","evidence_ids":["friends-memory","friends-narrative"],"section_id":"async-memory-boundary","status":"adopted"},{"decision_id":"bound-proactive-frequency","evidence_ids":["friends-proactive"],"section_id":"proactive-and-group-flow","status":"revised"},{"decision_id":"extend-group-conversation","evidence_ids":["friends-team","friends-narrative"],"section_id":"proactive-and-group-flow","status":"revised"},{"decision_id":"discard-stale-generations","evidence_ids":["friends-message-route","friends-generation-runner","friends-generation-schema"],"section_id":"proactive-and-group-flow","status":"adopted"},{"decision_id":"separate-image-payload","evidence_ids":["friends-chat","friends-narrative"],"section_id":"image-path","status":"revised"},{"decision_id":"constrain-image-generation","evidence_ids":["friends-schema","friends-chat"],"section_id":"image-path","status":"adopted"},{"decision_id":"preserve-text-on-image-failure","evidence_ids":["friends-chat"],"section_id":"image-path","status":"adopted"},{"decision_id":"recover-first-json-object","evidence_ids":["friends-chat","friends-narrative"],"section_id":"parser-and-safety","status":"revised"},{"decision_id":"guard-human-identity","evidence_ids":["friends-safety"],"section_id":"parser-and-safety","status":"adopted"},{"decision_id":"recover-meta-conversation","evidence_ids":["friends-safety"],"section_id":"parser-and-safety","status":"revised"},{"decision_id":"preserve-friend-on-delete","evidence_ids":["friends-schema"],"section_id":"relationship-memory","status":"adopted"},{"decision_id":"separate-memory-ownership","evidence_ids":["friends-memory","friends-schema"],"section_id":"relationship-memory","status":"adopted"},{"decision_id":"tier-conversation-context","evidence_ids":["friends-chat","friends-memory"],"section_id":"relationship-memory","status":"adopted"},{"decision_id":"model-situational-history","evidence_ids":["friends-context","friends-schema"],"section_id":"situational-reality","status":"adopted"},{"decision_id":"use-safety-state-machine","evidence_ids":["friends-safety","friends-safety-dialogue","friends-safety-runner","friends-safety-schema"],"section_id":"parser-and-safety","status":"adopted"},{"decision_id":"enforce-time-reality-across-paths","evidence_ids":["friends-context","friends-narrative"],"section_id":"situational-reality","status":"revised"}],"project_id":"260619-chat-friends","readiness":"ready","sections":[{"body":"이 제품의 목표는 모델에게 친구처럼 말하라는 한 줄 지시를 주는 것이 아니었다. 성격이 다른 세 친구가 1:1과 단체방에서 자기 말투를 유지하고, 과거 대화와 현재 상황을 구분하며, 먼저 연락하거나 이미지를 보내는 동안에도 관계 맥락을 잃지 않아야 했다. 사용자는 로그인해 관계를 이어갈 수 있고, 지속 저장이 필요 없는 demo 경로도 사용할 수 있다.\n\n기능이 늘수록 한 호출에 답변, 기억, 이미지와 안전 판단을 모두 넣는 방식은 실패 범위를 키웠다. 그래서 즉시 보여 줄 대화, 나중에 보강할 기억, 비용이 큰 이미지, 결정론적으로 유지할 안전 상태를 서로 다른 경계로 나눴다. 현재 작업 디렉터리에는 아직 통합 상태가 확정되지 않은 안전 변경이 있어, 글은 구현과 과거 검증을 현재 배포 완료로 합치지 않는다.\n","evidence_ids":["friends-narrative","friends-chat","friends-schema"],"id":"planning-background","section_type":"planning","title":"답변 생성보다 관계의 연속성"},{"body":"세 친구의 개성은 모델 선택만으로 구분하지 않고 말투 규칙, 금지 행동과 대화 예시로 고정했다. 같은 질문에 표현만 조금 달라지는 수준을 피하고, 단체방에서도 누가 어떤 관점으로 말하는지 구별할 수 있게 했다. 사용자는 OAuth 기반 계정으로 관계를 보존하거나 demo로 먼저 경험할 수 있다.\n\n무제한 캐릭터 제작과 공개 페르소나 마켓은 초기 범위가 아니다. 적은 수의 고정 친구를 깊게 다루고, 계정 진입 장벽과 지속성 요구를 분리하는 편이 기억 소유권과 안전 규칙을 검증하기 쉬웠다.\n","evidence_ids":["friends-personas","friends-narrative"],"id":"persona-and-entry","section_type":"decision","title":"고정 페르소나와 두 가지 진입 경로"},{"body":"초기에는 한 생성 결과에서 답변과 기억을 함께 얻으려 했지만, 기억 파싱이 실패하면 사용자가 이미 기다린 답변까지 실패하는 문제가 생겼다. 현재 흐름은 채팅 답변을 먼저 저장하고 반환한 뒤, 기억 추출을 in-process 비동기로 실행한다. 기억 실패는 기록하되 대화 응답을 되돌리지 않는다.\n\n이 격리는 체감 안정성을 높이지만 durable job queue는 아니다. 답변 저장 직후 프로세스가 종료되면 기억 작업은 유실될 수 있다. 따라서 대화 성공과 기억 반영 성공은 서로 다른 상태이며, 향후 재시도 가능한 작업 원장이 필요하다.\n","diagrams":[{"alt":"사용자 메시지가 채팅 생성과 답변 저장을 거쳐 즉시 반환되고 별도 비동기 기억 추출은 성공 시 기억 저장, 실패 시 대화 유지 상태로 끝나는 흐름","caption":"답변 저장 이후 비동기 기억 추출이 실패해도 사용자 대화는 유지되는 경계","id":"chat-memory-failure-boundary"}],"evidence_ids":["friends-chat","friends-memory","friends-narrative"],"id":"async-memory-boundary","section_type":"decision","title":"답변 저장과 기억 추출 분리"},{"body":"먼저 오는 메시지는 30분에서 2시간 사이 간격, 낮은 생략률과 친구별 세 번 상한으로 조정했다. 완전히 드문 이벤트로 만들지 않되 반복 알림처럼 느껴지지 않게 빈도와 상한을 함께 둔 것이다. 실제 장기 사용에서 이 간격이 적절한지는 아직 운영 지표가 없다.\n\n단체방은 확률에 따라 1~3마디 만에 끝나던 구조를 수정해 최소 4회, 보통 4~8회, 최대 30회 안전 상한을 사용한다. 동시에 생성된 중복 답장을 제거하고 generation version으로 오래된 흐름을 폐기한다. 사용자가 새 메시지를 보내면 이전 봇 대화가 뒤늦게 화면을 덮지 않게 한 결정이다.\n","evidence_ids":["friends-proactive","friends-team","friends-message-route","friends-generation-runner","friends-generation-schema","friends-narrative"],"id":"proactive-and-group-flow","section_type":"decision","title":"선톡 빈도와 단체 대화 길이 조정"},{"body":"이미지 데이터를 메시지 본문에 직접 넣으면 최근 대화를 읽을 때마다 큰 payload가 반복 전송됐다. 이미지는 별도 endpoint와 cache로 옮기고, 최근 60개 메시지를 고르는 정렬도 가장 최신 묶음을 가져오도록 바로잡았다. 이미지 기능의 실패가 텍스트 대화 조회를 느리게 만들지 않는 구조다.\n\n이미지 주제는 사용자 요청을 우선하고 얼굴 생성은 명시적인 요청에 한정한다. 비용과 중복 호출을 막기 위해 DB의 compare-and-set 쿨다운을 사용하며 실패한 시도도 쿨다운에 포함한다. 규칙과 구조화 판정을 함께 사용하되 이미지 생성 실패 시 텍스트 답변은 유지한다.\n","evidence_ids":["friends-chat","friends-schema","friends-narrative"],"id":"image-path","section_type":"decision","title":"이미지를 별도 경로와 캐시로 분리"},{"body":"모델이 완결된 JSON 뒤에 설명을 덧붙이는 실제 장애를 겪은 뒤, 전체 문자열이 정확히 JSON인지 요구하는 파서를 철회했다. 첫 번째 완결 객체를 읽고 구조가 맞지 않으면 정해진 fallback으로 돌아간다. 파서 오류가 사용자 대화 전체를 깨뜨리지 않게 한 수정이다.\n\n안전은 입력, 시스템과 출력 세 단계에서 다루고 인간인 척하지 않는 경계를 둔다. 경고문을 반복하는 대신 이전 실수를 인정하고 관계 대화로 복귀하는 meta-conversation recovery를 사용한다. 위기 대응은 prompt 하나에 맡기지 않고 상태기계와 친구다운 생성 응답을 결합해 한 번에 한 질문, 에피소드별 긴급 안내 횟수, 단체방 리드와 선톡 중단을 제어한다. 이 안전 변경의 현재 브랜치 통합 상태는 아직 확정되지 않았다.\n","evidence_ids":["friends-safety","friends-safety-dialogue","friends-safety-runner","friends-safety-schema","friends-chat","friends-narrative"],"id":"parser-and-safety","section_type":"decision","title":"구조화 출력 복구와 안전 대화 분리"},{"body":"친구 삭제는 행을 지우고 새 친구를 만드는 방식이 아니라 soft delete와 restore로 처리한다. 친구 ID, 과거 대화와 기억을 유지해 사용자가 다시 관계를 열었을 때 다른 사람처럼 시작하지 않게 했다. 삭제가 법적·운영적 영구 삭제를 의미하는 별도 요구와는 구분해야 한다.\n\n기억은 사용자에 대한 사실과 친구 자신의 경험을 분리하고 단체방에서 중복 추출된 항목을 정리한다. 누구의 기억인지가 불명확한 벡터 묶음보다 소유권을 먼저 모델링한 선택이다. 오늘의 KST 대화는 원문을 사용하고 과거는 일별 요약과 관련 기억 최대 3개로 줄여 시간 민감 질문에 오래된 요약이 사실처럼 쓰이지 않게 한다.\n","evidence_ids":["friends-memory","friends-schema","friends-chat"],"id":"relationship-memory","section_type":"decision","title":"삭제와 기억의 소유권을 분리"},{"body":"생활 프로필, 현재 상황과 친구 상태 변경 이력을 별도 구조로 둬 최근 몇 문장만으로 친구의 하루를 재구성하지 않는다. 현재 할 수 없는 취미나 이미 지난 약속을 현재 진행 중인 일처럼 말하는 문제가 발견된 뒤, 특정 문구 하나를 고치는 데서 멈추지 않고 모든 생성 경로의 상황 hard constraint로 범위를 넓혔다.\n\n현재 불가능한 행동은 과거 경험이나 미래 계획으로만 표현한다. 이 제약은 즉흥적인 문장 다양성을 줄일 수 있지만 관계형 제품에서 시간 모순이 반복되는 비용보다 작다고 판단했다. 과거에는 좁은 테스트가 통과했지만 장기 대화 전체의 현실성을 입증하지는 않는다.\n","evidence_ids":["friends-context","friends-narrative"],"id":"situational-reality","section_type":"decision","title":"생활 상태와 시간 현실성 유지"},{"body":"Next.js API와 화면이 Prisma 데이터베이스를 사용하고, conversation runner가 1:1과 단체 생성 흐름을 조정한다. 페르소나 규칙, 기억 추출, 이미지, 선톡, 팀 정책과 상황 컨텍스트는 별도 모듈로 나뉜다. generation version과 DB 상태가 늦은 응답과 쿨다운 충돌을 막는다.\n\n대화 답변은 먼저 영속화되고 기억 추출은 후속 비동기 작업이다. 안전 상태는 대화와 선톡 경로에 영향을 주지만 현재 변경분의 통합 및 migration 실행은 별도 확인이 필요하다.\n","evidence_ids":["friends-chat","friends-memory","friends-schema","friends-team","friends-generation-runner","friends-generation-schema","friends-safety-runner","friends-safety-schema"],"id":"implementation-flow","section_type":"implementation","title":"대화와 보조 작업의 구현 구조"},{"body":"과거 작업 기록은 모델 분리 단계에서 41개, 단체 대화 확장 단계에서 46개 테스트와 typecheck, build 통과를 보고한다. 이미지와 JSON 사고 문서에도 당시 범위별 26개와 34개 검증 기록이 있다. 이 수치는 각 변경 시점의 증거다.\n\n현재 브랜치는 원격보다 뒤처져 있고 안전 코드와 migration을 포함한 dirty 변경이 있다. 이번 글 작성에서 전체 테스트와 production build를 다시 실행하지 않았으므로 과거 수치를 현재 소스나 운영판의 통합 성공으로 바꾸지 않는다.\n","evidence_ids":["friends-narrative","friends-safety","friends-safety-dialogue","friends-safety-runner"],"id":"validation","section_type":"validation","title":"과거 자동 검증과 현재 작업 상태"},{"body":"in-process 기억 추출은 프로세스 종료 시 유실될 수 있고 재시도 원장이 없다. 안전 상태기계의 현재 통합과 migration, 운영자가 대화 개인정보에 접근하는 권한과 감사 정책도 확인되지 않았다. 이미지 비용과 쿨다운이 실제 UX에 미치는 영향, 선톡의 장기 피로도도 측정되지 않았다.\n\n현재 배포와 소스의 일치 여부를 확인하지 못했으므로 이 글은 코드와 과거 변경 근거를 설명한다. 관계 연속성을 위한 구조를 만들었다는 것과 실제 운영에서 지속적이고 안전한 친구 경험을 승인했다는 것은 다른 판정이다.\n","evidence_ids":["friends-narrative","friends-memory","friends-safety","friends-safety-dialogue","friends-safety-runner"],"id":"limitations","section_type":"result","title":"관계형 제품에 남은 운영 한계"}],"summary":"세 명의 고정 페르소나가 1:1과 단체 대화에서 기억, 이미지, 선톡과 안전 상태를 이어가도록 생성 경로를 나누고 실패를 격리한 선택을 정리한다.","title":"관계 맥락을 이어 가도록 설계한 AI 친구 채팅"}
