{"decision_index":[{"decision_id":"use-api-sqlite-ledger","evidence_ids":["feeling-server","feeling-web","feeling-widget"],"section_id":"shared-ledger","status":"adopted"},{"decision_id":"split-web-widget-roles","evidence_ids":["feeling-narrative","feeling-widget"],"section_id":"shared-ledger","status":"adopted"},{"decision_id":"separate-click-intents","evidence_ids":["feeling-widget","feeling-narrative"],"section_id":"click-intent","status":"revised"},{"decision_id":"limit-reminders-to-seven-days","evidence_ids":["feeling-memory","feeling-web"],"section_id":"reminder-window","status":"adopted"},{"decision_id":"keep-rule-fallback","evidence_ids":["feeling-server"],"section_id":"conversation-fallback","status":"adopted"},{"decision_id":"structure-recent-context-response","evidence_ids":["feeling-server","feeling-memory"],"section_id":"conversation-fallback","status":"adopted"},{"decision_id":"recover-widget-visibility","evidence_ids":["feeling-widget","feeling-narrative"],"section_id":"widget-visibility","status":"revised"},{"decision_id":"remove-pointer-evasion","evidence_ids":["feeling-narrative","feeling-widget"],"section_id":"widget-visibility","status":"rolled-back"},{"decision_id":"preserve-character-silhouette","evidence_ids":["feeling-narrative"],"section_id":"widget-visibility","status":"revised"},{"decision_id":"show-value-before-payment","evidence_ids":["feeling-memory"],"section_id":"product-expansion","status":"adopted"},{"decision_id":"stage-insight-depth","evidence_ids":["feeling-memory"],"section_id":"product-expansion","status":"adopted"},{"decision_id":"track-conversation-need-safely","evidence_ids":["feeling-memory"],"section_id":"product-expansion","status":"unresolved"}],"project_id":"260212-feeling-traker","readiness":"ready","sections":[{"body":"감정 기록은 항목이 많아서 실패하기보다 기록할 순간에 화면을 찾아 들어가는 과정이 길어서 끊기기 쉽다. 이 프로젝트는 웹 대시보드 하나에 모든 기능을 넣는 대신, 데스크톱에는 바로 누를 수 있는 작은 위젯을 두고 웹에는 기록 관리와 통계를 남겼다. 사용자는 일하는 흐름을 크게 끊지 않고 상태를 남긴 뒤, 필요할 때 넓은 화면에서 지난 기록을 돌아볼 수 있다.\n\n초기 범위는 웹과 데스크톱에 한정했다. 별도 모바일 앱, 다중 사용자 계정, 장기 예측은 동시에 만들지 않았다. 핵심 질문은 두 화면이 같은 기록을 보고 있는지, 클릭 의도가 중복 창이나 잘못된 동작으로 바뀌지 않는지, 외부 대화 기능을 쓰지 못해도 기록 자체는 계속되는지였다.\n","evidence_ids":["feeling-narrative","feeling-server"],"id":"planning-background","section_type":"planning","title":"기록 마찰을 줄이는 두 개의 화면"},{"body":"웹과 위젯이 각자의 로컬 상태를 갖게 하면 같은 날의 감정이 서로 다르게 보이고, 어느 쪽이 최신인지 설명하기 어렵다. 그래서 Python API가 SQLite를 소유하고 두 클라이언트가 같은 기록 API를 호출하도록 했다. 브라우저 저장소는 화면 보조 상태에만 쓰고 감정 기록과 대화 데이터의 정본으로 삼지 않았다.\n\n웹은 입력 내역, 통계와 수정에 집중하고 위젯은 즉시 기록에 집중한다. 역할은 다르지만 저장 경로는 하나다. 이 구조는 초기 제품에 필요한 일관성을 얻는 대신 단일 로컬 데이터베이스와 서버 프로세스에 의존하며, 여러 사용자나 여러 기기 간 동기화까지 해결하지는 않는다.\n","evidence_ids":["feeling-server","feeling-web","feeling-widget"],"id":"shared-ledger","section_type":"decision","title":"브라우저 저장소 대신 공통 원장 채택"},{"body":"위젯의 단일 클릭과 더블 클릭이 동시에 처리되면 기록 창과 대화 창이 연달아 열리고, 클릭할 때마다 새 창이 늘어날 수 있었다. 입력을 즉시 실행하는 대신 짧게 지연한 뒤 더블 클릭이 확인되면 단일 클릭 동작을 취소하는 방식으로 바꿨다. 팝업도 새 인스턴스를 계속 만들지 않고 기존 창을 다시 앞에 보낸다.\n\n기록 화면에서는 `저장`과 `저장 후 채팅`을 다른 명령으로 유지했다. 기록만 남기려는 사용자에게 대화를 강요하지 않고, 대화가 필요한 순간에는 저장된 맥락을 이어서 사용한다. 하나의 모호한 버튼으로 두 의도를 합치는 것보다 다음 상태를 예측할 수 있는 흐름을 택한 결정이다.\n","evidence_ids":["feeling-widget","feeling-narrative"],"id":"click-intent","section_type":"decision","title":"단일 클릭과 대화 시작을 분리"},{"body":"오랫동안 기록하지 않은 모든 날짜를 한꺼번에 보여 주면 회고를 돕기보다 밀린 숙제처럼 느껴질 수 있다. 누락 안내는 최근 7일로 한정해 복구 가능한 짧은 공백만 보여 주도록 했다. 장기 공백 전체를 채우게 만드는 대안보다 다시 기록을 시작하는 부담을 낮추는 쪽을 선택했다.\n\n이 제한은 과거 데이터가 중요하지 않다는 뜻이 아니다. 통계와 상세 조회에서는 기존 기록을 유지하되, 행동을 촉구하는 알림만 좁게 사용한다. 실제 장기 사용에서 알림 피로와 재기록률이 어떻게 달라지는지는 측정되지 않았다.\n","evidence_ids":["feeling-memory","feeling-web"],"id":"reminder-window","section_type":"decision","title":"누락 알림을 최근 일주일로 제한"},{"body":"감정 기록 뒤의 대화는 외부 모델을 사용할 수 있을 때 더 다양한 응답을 만들지만, 외부 설정이나 네트워크가 없다는 이유로 기록과 기본 피드백까지 멈추게 하지 않았다. 서버는 규칙 기반 응답을 기본 안전망으로 두고 외부 호출이 실패하면 같은 경로에서 로컬 응답으로 돌아온다.\n\n대화 결과는 자유 텍스트 하나가 아니라 답변, 감정, 원인 후보와 다음 행동으로 나눈다. 모델에는 최근 대화 일부만 전달해 현재 맥락을 잇되 장기 기억 시스템처럼 포장하지 않았다. 이 구조는 출력 소비를 단순화하지만 감정 분류는 여전히 키워드 중심이고, 위기 상황을 전문 지원으로 연결하는 안전 흐름은 없다.\n","evidence_ids":["feeling-server","feeling-memory"],"id":"conversation-fallback","section_type":"decision","title":"선택적 대화와 로컬 안전망"},{"body":"WSL과 다중 화면 환경에서는 저장된 좌표가 현재 화면 바깥에 놓이거나 글꼴과 이모지 차이로 아이콘이 보이지 않는 문제가 있었다. 시작할 때 위치를 화면 경계 안으로 보정하고, 진단용 가시성 모드를 두며, 특정 글꼴에 의존하는 요소는 Canvas 도형으로 대체할 수 있게 했다.\n\n포인터를 따라 피하는 움직임도 철회했다. 장난스러운 효과보다 클릭할 대상이 움직이지 않는 것이 중요하다는 요구에 따라 hover와 press 때의 작은 눌림 표현만 남겼다. 브랜드 캐릭터는 기존 실루엣을 유지하고 감정 상태 차이는 색으로 표현했으며, 형태를 과장하거나 다른 캐릭터 체계로 바꾸지 않았다.\n","evidence_ids":["feeling-widget","feeling-narrative"],"id":"widget-visibility","section_type":"decision","title":"화면에서 사라지지 않는 위젯"},{"body":"문서상 제품 확장은 규칙 기반 요약, 추세, 예측의 세 단계로 잡았다. 현재 구현이 규칙과 단순 추세 수준에 머문 상태에서 예측을 제공한다고 말하지 않으며, 사용자가 첫 유효 인사이트를 보기 전에 결제를 요구하는 흐름도 채택하지 않았다. 먼저 기록에서 얻는 가치를 확인한 뒤 유료 기능을 검토한다는 순서다.\n\n반복적으로 대화가 필요한 사용자는 별도 행동 지표로 보고, 감정을 꺼낸 뒤에는 최소한의 다음 행동을 제공하는 방향을 정했다. 다만 이 항목들은 제품 전략과 backlog에 가깝다. 위기 도움 연결, 반복 우울 신호의 안전 장치, 과금과 고급 예측은 현재 성과가 아니다.\n","evidence_ids":["feeling-memory","feeling-narrative"],"id":"product-expansion","section_type":"decision","title":"인사이트와 과금의 순서"},{"body":"Python HTTP 서버가 감정 기록과 대화 API를 제공하고 SQLite에 저장한다. 정적 웹은 조회, 수정과 통계를 담당하며 Tk 위젯은 같은 API로 빠른 기록과 대화 팝업을 연다. 위젯 위치와 아이콘 상태 같은 화면 설정은 별도 로컬 설정에 보존된다.\n\n대화 요청은 서버에서 구조화되고 외부 호출이 불가능하면 규칙 기반 경로로 복귀한다. 이 구조 덕분에 화면별 책임과 데이터 정본은 구분되지만, 서버가 내려가면 두 클라이언트 모두 공통 기록에 접근할 수 없고 SQLite의 동시성 운영도 아직 단순하다.\n","evidence_ids":["feeling-server","feeling-widget","feeling-web"],"id":"implementation-flow","section_type":"implementation","title":"기록과 대화가 저장되는 구조"},{"body":"현재 분석에서는 Python 서버와 위젯, 브라우저 스크립트의 문법을 확인했다. 과거 작업 기록에는 구조화 응답의 필드와 응답 출처 확인, 위젯 창 충돌과 위치 보정 수정이 남아 있다. 자동 회귀 테스트 묶음은 없어 문법 통과를 제품 동작 전체의 검증으로 볼 수 없다.\n\nWSL GUI에서의 실제 표시, 여러 모니터 사이 위치 복구, 캐릭터의 모든 상태 전환, 키보드와 보조기술 접근성, 장기 사용 통계는 이번에 실행하지 않았다. 과거 실행 흔적도 현재 운영 환경이나 실제 사용자 결과를 대신하지 않는다.\n","evidence_ids":["feeling-narrative","feeling-widget"],"id":"validation","section_type":"validation","title":"확인한 동작과 확인하지 못한 화면"},{"body":"SQLite는 단일 사용자 로컬 사용을 전제로 하고 동시 쓰기와 복구 정책이 충분히 다듬어지지 않았다. 모바일, 계정 동기화, 백업과 다중 사용자 경계도 없다. 감정 분류는 전문 평가가 아니라 단순한 제품 로직이며, 위기 도움 연결을 제공하지 않는다.\n\n고급 인사이트, 예측, 과금과 별도 KPI는 문서의 다음 단계다. 현재 확인된 결과는 웹과 데스크톱 위젯이 하나의 기록을 공유하고, 빠른 입력과 관리 화면의 역할을 나눈 MVP라는 범위에 한정된다.\n","evidence_ids":["feeling-memory","feeling-server"],"id":"limitations","section_type":"result","title":"초기 제품에 남은 한계"}],"summary":"빠른 입력은 데스크톱 위젯에, 관리와 통계는 웹에 맡기고 하나의 SQLite 원장으로 기록과 대화를 연결한 초기 감정 기록 제품의 결정과 한계를 정리한다.","title":"웹과 위젯을 잇는 감정 기록 도구"}
