{"decision_index":[{"decision_id":"own-dictionary-assets-independently","evidence_ids":["dictionary-readme"],"section_id":"independent-asset-owner","status":"adopted"},{"decision_id":"split-four-dictionary-roles","evidence_ids":["dictionary-policy","dictionary-guide"],"section_id":"four-dictionary-roles","status":"adopted"},{"decision_id":"separate-precision-and-recall","evidence_ids":["dictionary-policy","dictionary-guide"],"section_id":"precision-recall-contract","status":"adopted"},{"decision_id":"protect-ambiguous-fallback","evidence_ids":["dictionary-policy"],"section_id":"protect-ambiguous-input","status":"adopted"},{"decision_id":"separate-evaluation-populations","evidence_ids":["dictionary-guide","dictionary-novdec"],"section_id":"separate-evaluation-populations","status":"adopted"},{"decision_id":"gate-release-with-holdout","evidence_ids":["dictionary-release-gate","dictionary-q1","dictionary-march"],"section_id":"holdout-release-gate","status":"adopted"},{"decision_id":"keep-rule-order-unresolved","evidence_ids":["dictionary-policy","dictionary-guide"],"section_id":"resolve-rule-order","status":"unresolved"},{"decision_id":"separate-moe-shadow-contract","evidence_ids":["dictionary-moe-shadow"],"section_id":"separate-moe-shadow","status":"adopted"}],"project_id":"260413-dictionary-transition-bundle","readiness":"ready","sections":[{"body":"기능 호출 사전은 문장을 많이 등록할수록 좋아지는 목록이 아니다. 완성 명령을 정확히 잡는 규칙과 두 개 이상의 단서를 조합해 재현율을 높이는 규칙, 음성 인식 오류를 보정하는 규칙은 오탐 비용이 서로 다르다. 특히 일상대화를 담당하는 fallback을 공격적으로 빼앗으면 기능 호출 수치는 오르더라도 실제 대화 품질은 나빠질 수 있다.\n\n이 프로젝트는 Semantic Verb Schema와 MoE 실험에 흩어진 dictionary 전환 자산을 독립 번들로 모으고, 사전 역할·충돌 순서·평가 모집단을 분리했다. 목표는 가장 높은 정확도 하나를 고르는 것이 아니라 어느 조건에서 룰베이스가 LLM을 대체할 수 있고 어디에서 아직 멈춰야 하는지를 판단하는 것이었다.\n","evidence_ids":["dictionary-readme","dictionary-policy","dictionary-guide"],"id":"planning-background","section_type":"planning","title":"사전 정확도 한 줄로는 설명할 수 없는 문제"},{"body":"active dictionary, 생성 중간본, 릴리즈 묶음과 리플레이 결과를 전용 프로젝트가 소유하도록 했다. Semantic 프로젝트는 동사 학습에, MoE 프로젝트는 라우팅에 집중하고 dictionary 전환 자료는 여기서 찾도록 책임을 분리했다.\n\n이 이동은 새로운 runtime을 만든 것이 아니다. 어떤 파일이 정본인지와 누가 변경을 검토해야 하는지를 명확히 한 작업이다. 현재 번들에는 프로덕션 호출 경로가 없으므로 사전 자산의 존재를 배포 완료와 동일하게 보지 않는다.\n","evidence_ids":["dictionary-readme"],"id":"independent-asset-owner","section_type":"decision","title":"사전과 평가 자산을 독립 번들로 이동"},{"body":"`substitution`은 STT 오인식과 동음 변형을 교정하고, `mapping`은 의도가 분명한 완성 명령을 직접 매핑한다. `contains_token`은 엔티티와 액션 그룹을 함께 확인해 표현 다양성을 흡수하며, `contains`는 파라미터와 보조 단서를 추출한다.\n\n하나의 거대한 사전은 어떤 규칙이 오탐을 만들었는지 찾기 어렵다. 네 역할을 나누면 정밀도 문제와 재현율 문제, 음성 인식 문제를 서로 다른 변경으로 다룰 수 있다. 대신 최종 판정 순서가 분명하지 않으면 같은 발화가 여러 규칙에 걸려 결과가 달라진다.\n","evidence_ids":["dictionary-policy","dictionary-guide"],"id":"four-dictionary-roles","section_type":"decision","title":"사전을 네 가지 역할로 분해"},{"body":"`mapping`에는 대상과 실행 의도가 분명하고 오매칭 위험이 낮은 문장만 넣어 정밀도를 우선했다. `contains_token`은 최소 엔티티 그룹과 액션 그룹을 함께 요구하면서 더 넓은 표현을 포괄해 재현율을 맡는다. 신규 발화는 우선 조합 규칙으로 일반화하고, 짧은 완성 문장은 단일 의도가 고정될 때만 직접 매핑한다.\n\n이 분리는 등록 회의의 질문도 바꿨다. “이 문장을 추가할까”가 아니라 “직접 실행해도 되는가, 두 단서가 필요한가, fallback으로 남겨야 하는가”를 결정하게 한다. 같은 정확도 개선이라도 어떤 계층을 바꿨는지에 따라 운영 위험이 달라진다.\n","evidence_ids":["dictionary-policy","dictionary-guide"],"id":"precision-recall-contract","section_type":"decision","title":"mapping과 contains_token의 목표를 분리"},{"body":"`올려`, `내려`, `켜`, `꺼`처럼 대상이 없는 짧은 동사는 여러 기능에 적용될 수 있다. 직전 대화에서 대상이 확정됐으면 그 문맥을 재사용하고, 문맥이 없으면 중간 인텐트로 보내 재질문하도록 정책을 정했다. 상태 서술형과 질문형도 직접 실행 mapping에서 제외했다.\n\n짧은 단어를 대량 등록하면 표면 coverage는 빠르게 늘지만 잘못된 기기 동작으로 이어질 수 있다. 따라서 엔티티 결합, 명령형 표지, 상태 서술 부재를 함께 확인하고 fallback을 보호했다.\n","evidence_ids":["dictionary-policy"],"id":"protect-ambiguous-input","section_type":"decision","title":"대상 없는 짧은 동사는 바로 실행하지 않음"},{"body":"운영 로그의 기존 라벨인 raw와 사람이 재검수한 corrected 라벨을 같은 정답으로 취급하지 않았다. 학습·튜닝에 쓰인 기간과 이후 시기의 홀드아웃도 분리했다. Q1 corrected 집계, 3월 홀드아웃, 11~12월 raw/corrected 결과는 모집단과 정답 계약이 달라 한 숫자로 평균낼 수 없다.\n\n실제 차이는 컸다. 11~12월 전체 정확도는 raw 88.49%, corrected 96.96%였고 non19는 각각 29.45%, 86.41%였다. 이는 사전 자체의 차이뿐 아니라 기존 라벨 노이즈와 문맥 기준이 결과를 크게 바꾼다는 뜻이다.\n","evidence_ids":["dictionary-guide","dictionary-novdec"],"id":"separate-evaluation-populations","section_type":"decision","title":"raw·corrected·홀드아웃을 따로 평가"},{"body":"배포 판단은 전체 정확도만 보지 않는다. 직전 버전보다 fallback 정확도가 떨어지지 않아야 하고, non19가 유지되거나 상승해야 하며, 학습하지 않은 기간에서 다시 검증해야 한다. 모호한 발화는 수동 라벨 확정 전 production rule로 넣지 않는다.\n\nQ1 quick 결과는 538,023행에서 all 99.70%, non19 95.10%, fallback 99.94%였다. 3월 corrected 홀드아웃은 all 99.30%, non19 90.85%, fallback 99.76%였다. 높은 전체 수치만 인용하지 않고 non19와 시기별 변동을 함께 남기는 이유다.\n","evidence_ids":["dictionary-release-gate","dictionary-q1","dictionary-march"],"id":"holdout-release-gate","section_type":"decision","title":"non19와 fallback을 함께 보는 배포 게이트"},{"body":"정책 문서는 substitution 뒤 mapping, contains_token, contains 순서를 권장한다. 반면 팀 가이드는 contains, contains_token, mapping의 직렬 순서를 제시한다. 같은 계층 안에서는 마지막 규칙을 채택한다는 설명도 있어 배치 순서는 실제 최종 토큰을 바꾼다.\n\n어느 문서가 최신인지 추정해 덮지 않고 이 충돌을 공개 한계로 남겼다. 배포 전에는 실행 코드의 실제 우선순위와 정책 문서를 하나로 맞추고, 충돌한 모든 rule과 최종 rule을 로그에 함께 기록해야 한다.\n","evidence_ids":["dictionary-policy","dictionary-guide"],"id":"resolve-rule-order","section_type":"decision","title":"충돌 순서를 아직 단일화하지 못한 상태"},{"body":"MoE shadow는 dictionary replay와 다른 계약이다. 593건에서 오류 없이 실행됐지만 route 정확도 83.81%, policy 정확도 85.83%, end-to-end 정확도 75.04%, 턴 p95 약 5.93초였다. 일부 보조 단계가 안정적이어도 전체 라우팅과 최종 결과가 같은 수준이라는 뜻은 아니다.\n\n따라서 이 수치를 사전 성능에 합쳐 “LLM 대체 완료”라고 쓰지 않았다. 룰 선택 품질, 라우팅 품질, 최종 응답과 지연은 각각 다른 gate로 관리해야 한다.\n","evidence_ids":["dictionary-moe-shadow"],"id":"separate-moe-shadow","section_type":"decision","title":"MoE shadow 결과를 사전 정확도와 분리"},{"body":"번들에는 네 종류의 active dictionary, 과거 생성본과 릴리즈 묶음, 기간별 리플레이 결과, 팀 정책과 shadow report가 함께 있다. 이 구조만으로 어떤 결과가 어떤 자산에서 나왔는지 비교할 수 있다.\n\n그러나 이전 위치에서 옮겨온 평가 스크립트는 과거 루트 경로를 기대하고 현재 `from_semantic` 배치를 자동으로 찾지 못한다. 사전과 결과는 역사 근거로 유효하지만, 새 위치에서 한 명령으로 재생되는 handoff는 아직 복구되지 않았다.\n","evidence_ids":["dictionary-readme","dictionary-policy","dictionary-guide"],"id":"implementation-assets","section_type":"implementation","title":"현재 자산과 재실행 경계"},{"body":"Q1 quick, 3월 corrected 홀드아웃과 11~12월 raw/corrected 결과 파일은 현재 번들에 남아 있다. 이 결과는 corrected 기준에서 높은 성능 구간이 있었고 raw 기준에서는 대체가 불충분했다는 판단을 지지한다.\n\n특정 snapshot의 non19 95.10%를 모든 버전에 일반화하지 않는다. 다른 스냅샷과 홀드아웃에서는 값이 달랐고, 현재 production 호출 경로나 독립 재실행은 확인되지 않았다. 공유 가능한 것은 사전·정책·과거 평가 결과이며 출시 승인은 아니다.\n","evidence_ids":["dictionary-q1","dictionary-march","dictionary-novdec","dictionary-guide"],"id":"verified-results","section_type":"validation","title":"확인된 결과와 해석 범위"},{"body":"이 프로젝트가 만든 핵심 가치는 정밀 사전과 재현율 사전을 분리하고, raw와 corrected의 간극을 운영 판단으로 바꾼 것이다. 사전 자산의 소유 위치도 명확해졌다.\n\n다음 단계는 룰 우선순위를 하나로 고정하고, 이동 후 경로에서 평가를 재실행하며, 현재 runtime이 어느 사전 snapshot을 읽는지 확인하는 것이다. 그 전까지는 룰베이스 대체 가능성을 검토한 검증 번들이며 프로덕션 대체 완료 프로젝트로 표현하지 않는다.\n","evidence_ids":["dictionary-policy","dictionary-guide","dictionary-readme"],"id":"current-status","section_type":"result","title":"현재 상태와 다음 gate"}],"summary":"하나의 키워드 목록을 네 종류의 사전으로 분해하고, raw와 corrected 라벨 및 시기별 홀드아웃을 따로 읽어 LLM 대체 가능성과 배포 한계를 판단한 과정을 정리한다.","title":"기능 호출 사전의 역할 분리와 홀드아웃 검증"}
