{"project_id":"alpha","readiness":"ready","sections":[{"body":"The routing decision is published as a deterministic public contract.","diagrams":[{"alt":"Routing flow","caption":"Public routing flow","id":"routing-flow"}],"evidence_ids":["routing-proof"],"id":"routing","section_type":"decision","title":"Routing"}],"summary":"Public routing decision record","title":"Routing decision record"}
