{"decision_index":[{"decision_id":"use-human-review-matrix","evidence_ids":["make-slot-matrix"],"section_id":"slot-model","status":"adopted"},{"decision_id":"normalize-five-slot-sets","evidence_ids":["make-slot-matrix"],"section_id":"slot-model","status":"adopted"},{"decision_id":"centralize-aliases","evidence_ids":["make-alias-dependency"],"section_id":"alias-dependency","status":"adopted"},{"decision_id":"separate-dependency-rules","evidence_ids":["make-alias-dependency"],"section_id":"alias-dependency","status":"adopted"},{"decision_id":"keep-one-condition-per-row","evidence_ids":["make-slot-matrix"],"section_id":"one-condition-row","status":"adopted"},{"decision_id":"generate-change-combinations","evidence_ids":["make-generator-ownership"],"section_id":"generator-ownership","status":"adopted"},{"decision_id":"leave-delete-resolution-to-agent","evidence_ids":["make-generator-ownership"],"section_id":"generator-ownership","status":"adopted"},{"decision_id":"preserve-v0-archive","evidence_ids":["make-archive"],"section_id":"archive-and-rollback","status":"adopted"},{"decision_id":"require-positive-source-span","evidence_ids":["make-positive-negative","make-negative-count"],"section_id":"positive-data","status":"adopted"},{"decision_id":"enforce-negative-route-quotas","evidence_ids":["make-negative-rules"],"section_id":"negative-data","status":"adopted"},{"decision_id":"route-command-by-action-family","evidence_ids":["make-command-current"],"section_id":"command-family","status":"adopted"}],"project_id":"260626-make-test-set","readiness":"ready","sections":[{"body":"테스트 문장을 바로 늘리면 어떤 slot이 필수이고 어떤 값이 생략 또는 추론되는지 사람마다 다르게 해석한다. 이 프로젝트는 O/X 중심의 spreadsheet matrix를 사람이 검토하는 정본 표면으로 두고, generator가 그 규칙에서 데이터를 만들도록 바꿨다.\n\n제품은 문장 묶음이 아니라 생성 계약이다. schedule, 문서 기반 positive, 경계용 negative와 기기 command를 서로 다른 검증 규칙으로 관리한다.\n","evidence_ids":["make-slot-matrix","make-positive-negative","make-negative-count","make-command-current","make-command-rows"],"id":"background","section_type":"planning","title":"데이터보다 먼저 규칙을 읽을 수 있게 만들기"},{"body":"slot을 required, optional, disabled, inferred, changeable로 나눈다. 발화에 없어도 규칙으로 채워지는 값과 수정 가능한 값을 필수 slot에 섞지 않는다.\n\n이 구분은 생성기 내부 enum이 아니라 spreadsheet에서 검토할 수 있다. 기획자가 규칙 변경의 영향을 보고 개발자는 같은 상태를 기계적으로 파싱한다.\n","evidence_ids":["make-slot-matrix"],"id":"slot-model","section_type":"decision","title":"slot 상태를 다섯 집합으로 분리"},{"body":"canonical value와 다양한 표현은 term dictionary에 모은다. 하위 조건의 parent-child 관계와 생략 허용은 dependency rule로 분리해 각 테스트 행에 반복하지 않는다.\n\n중복을 줄이는 동시에 별칭 변경과 slot 구조 변경의 영향을 따로 검토할 수 있게 한 선택이다.\n","evidence_ids":["make-alias-dependency"],"id":"alias-dependency","section_type":"decision","title":"alias와 dependency를 별도 규칙으로 관리"},{"body":"한 조건 조합을 여러 행으로 흩뜨리지 않고 문장형, 키워드형, fragment와 alias 발화를 같은 행에 묶는다. 생성 다양성과 정답 조건을 분리해 사람이 한눈에 비교할 수 있다.\n\n문장 수를 늘리는 것보다 조건 coverage가 먼저다. 같은 뜻의 표현이 많아도 새 조건을 검증한 것으로 세지 않는다.\n","evidence_ids":["make-slot-matrix"],"id":"one-condition-row","section_type":"decision","title":"조건 조합 하나를 한 행으로 유지"},{"body":"사람이 가능한 change slot 조합을 모두 직접 쓰지 않는다. changeable slots와 pattern type에서 generator가 수정 발화를 파생한다.\n\n삭제는 부분 식별 발화까지만 데이터가 만들고 실제 0개, 1개, 복수 match 처리와 재질문은 실행 agent가 소유한다. 테스트 데이터가 runtime 정책을 대신 결정하지 않게 한 경계다.\n","evidence_ids":["make-generator-ownership"],"id":"generator-ownership","section_type":"decision","title":"수정 조합은 generator가 생성"},{"body":"schedule matrix 산출물은 2,641행이며 현재 worklog는 조건당 한 행과 주요 발화 공백이 없다고 기록한다. 이는 matrix와 generator가 계약대로 파일을 만들었다는 증거다.\n\n시간·반복 정규화와 실제 agent의 match 정책까지 검증한 결과는 아니다. 생성 완주와 downstream 품질을 구분한다.\n","evidence_ids":["make-schedule-count"],"id":"schedule-output","section_type":"validation","title":"schedule matrix 2,641행"},{"body":"문서에서 답할 수 있는 질문만 만들고 source span, intent, tone과 answerable을 함께 남긴다. 현재 산출물은 673행이며 8개 source coverage, 중복과 CSV·JSONL 일치를 검사한다.\n\n규칙 기반 source span이 실제 정답 근거인지 사람 표본 감사는 남아 있다. 이 gate는 생성 데이터 계약을 검증하며 답변 모델 정확도를 검증하지 않는다.\n","evidence_ids":["make-positive-negative","make-negative-count"],"id":"positive-data","section_type":"decision","title":"positive는 source span을 필수화"},{"body":"unsupported, 일반 대화, 외부 지식과 공격·민감 경계를 route quota로 나누고 중복, 길이와 금지 패턴을 검사한다. 현재 산출물은 500행이다.\n\n무작위 부정 문장을 모으는 대신 실제 router가 갈라야 할 경계를 데이터 분포에 반영했다. 하지만 router가 이 500행을 맞혔다는 성능 수치는 아니다.\n","evidence_ids":["make-negative-rules"],"id":"negative-data","section_type":"decision","title":"negative는 route별 경계를 설계"},{"body":"표면 동사가 비슷하더라도 이동, 복귀, 상태 조회와 설정 변경에는 서로 다른 표현 제약이 필요하다. action family를 먼저 정하고 대표 intent-token마다 최소 10개를 생성한다.\n\n현재 파일은 157개 대표 기준으로 1,570행이다. 전역 중복과 family별 부적합 동작어를 생성 단계에서 실패시킨다.\n","evidence_ids":["make-command-current"],"id":"command-family","section_type":"decision","title":"command는 action family를 먼저 본다"},{"body":"초기 범위는 73개에서 157개로 넓어졌지만 후속 검토에서 수행 불가 항목만 제외한 대표 기준은 약 176개로 정정됐다. 원본 generator는 실제 기기 동작이 `명령 수행` 또는 `상태 확인`인 항목만 통과시키므로 현재 산출물은 여전히 157개 기준이다.\n\n1,570행을 전체 command coverage 완료로 쓰지 않는다. 현재 상태는 157/176 below-gate이며 누락 19개를 분류하고 재생성해야 한다.\n","evidence_ids":["make-command-current","make-command-rows","make-command-gap"],"id":"command-gap","section_type":"decision","title":"command coverage 157/176"},{"body":"v0 입력과 결과를 삭제하지 않고 archive로 옮겨 최신 형식과 분리했다. 확정 matrix와 충돌하는 참고 prompt는 우선순위에서 내리고 matrix와 정책을 기준으로 삼는다.\n\n과거 결과를 최신 입력으로 오해하지 않으면서도 형식 변경 전후를 비교할 수 있는 rollback 자료를 남긴다.\n","evidence_ids":["make-archive"],"id":"archive-and-rollback","section_type":"decision","title":"이전 형식을 archive로 보존"},{"body":"command는 157/176으로 미달이고 positive source span의 사람 정답성 감사가 없다. 생성 문장의 자연스러움, 실제 router 정확도와 RAG 답변 품질도 별도 평가가 필요하다.\n\n다음 단계는 176개 대표 기준 재생성, 차이 보고, 사람 표본 감사와 downstream 고정 평가다.\n","evidence_ids":["make-command-gap","make-positive-negative","make-negative-count","make-negative-rules"],"id":"limitations","section_type":"result","title":"생성 통과 이후의 gate"}],"summary":"사람이 검토하는 slot matrix와 생성기 규칙을 분리하고 schedule, positive, negative, command 데이터의 품질 gate와 157/176 coverage 미달을 정리한다.","title":"한국어 테스트셋 생성 규칙 정리"}
