{"decision_index":[{"decision_id":"share-three-execution-surfaces","evidence_ids":["gemini-three-surfaces"],"section_id":"shared-runner","status":"adopted"},{"decision_id":"make-session-state-explicit","evidence_ids":["gemini-session-state"],"section_id":"session-state","status":"adopted"},{"decision_id":"feed-style-signal-forward","evidence_ids":["gemini-session-state"],"section_id":"session-state","status":"adopted"},{"decision_id":"reduce-provider-schema","evidence_ids":["gemini-schema-fallback"],"section_id":"schema-compatibility","status":"revised"},{"decision_id":"parse-json-best-effort","evidence_ids":["gemini-json-recovery"],"section_id":"json-recovery","status":"adopted"},{"decision_id":"retry-network-errors-only","evidence_ids":["gemini-retry-policy"],"section_id":"retry-policy","status":"adopted"},{"decision_id":"reset-state-per-excel-row","evidence_ids":["gemini-row-reset"],"section_id":"row-isolation","status":"adopted"},{"decision_id":"preserve-full-call-log","evidence_ids":["gemini-session-state"],"section_id":"full-call-log","status":"adopted"}],"project_id":"gemini-multiturn-tester-v3","readiness":"ready","sections":[{"body":"단일 prompt 테스트는 이전 turn의 표현과 persona 변화가 다음 답변에 주는 영향을 볼 수 없다. 이 프로젝트는 interactive REPL, JSON scenario와 XLSX batch에서 같은 session state를 사용해 멀티턴 흐름을 반복 실행한다.\n\n목표는 정답률을 즉시 만드는 것이 아니라 어떤 history와 style 상태로 호출했고, 모델 출력이 다음 turn에 무엇을 바꿨는지 추적하는 것이다.\n","evidence_ids":["gemini-three-surfaces","gemini-session-state"],"id":"background","section_type":"planning","title":"단발 호출로 보이지 않는 변화"},{"body":"개발자는 REPL로 즉시 대화하고, JSON으로 정해진 scenario를 반복하며, 비개발 검토자는 XLSX에서 여러 행을 편집할 수 있다. 세 모드는 같은 호출과 기록 구조를 사용한다.\n\n별도 구현을 세 개 만드는 대신 입력 표면만 바꿔 같은 state transition을 비교할 수 있게 했다.\n","evidence_ids":["gemini-three-surfaces"],"id":"shared-runner","section_type":"decision","title":"세 실행 표면의 공통 계약"},{"body":"user와 model history를 SessionState가 소유한다. 모델 응답의 style signal은 현재 persona vector를 바꾸고, 다음 turn의 system prompt 선택에 반영된다.\n\n즉 v3의 실험 대상은 한 번의 답변이 아니라 응답이 다음 호출의 조건을 바꾸는 누적 과정이다. 이 상태를 전역 변수에 숨기지 않아 scenario별 초기화와 로그 대조가 가능하다.\n","evidence_ids":["gemini-session-state"],"id":"session-state","section_type":"decision","title":"history와 persona를 명시적 상태로 관리"},{"body":"지원이 불확실한 JSON Schema 제약을 제거하고 필수 필드 중심으로 축소했다. provider와 schema가 충돌하면 no-schema 옵션으로 실행할 수 있다.\n\n강한 schema를 고집해 호출 자체를 실패시키는 것보다 구조화 모드와 호환 모드를 비교할 수 있는 선택이다. no-schema 결과는 동일한 구조 보장을 갖지 않으므로 별도 조건으로 읽어야 한다.\n","evidence_ids":["gemini-schema-fallback"],"id":"schema-compatibility","section_type":"decision","title":"provider 호환 범위로 schema 축소"},{"body":"모델이 JSON 앞뒤에 설명을 붙인 경우 첫 번째 완결 객체를 찾아 복구한다. 복구하지 못해도 raw response와 request 기록을 남기고 scenario 전체를 즉시 폐기하지 않는다.\n\nbest-effort parser는 실패를 숨기는 장치가 아니다. structured field가 비어 있다는 상태와 원문을 함께 남겨 후속 분석이 가능하게 한다.\n","evidence_ids":["gemini-json-recovery"],"id":"json-recovery","section_type":"decision","title":"구조 실패에서도 raw 기록 보존"},{"body":"연결, SSL과 timeout 같은 네트워크성 오류는 최대 3회 재시도한다. 일반 HTTP 오류는 현재 즉시 실패해 잘못된 요청을 반복하지 않는다.\n\n다만 429나 일시적인 서버 오류도 재시도하지 않는 현재 정책은 긴 batch의 안정성 한계다. 오류 코드별 backoff와 재개 지점은 아직 없다.\n","evidence_ids":["gemini-retry-policy"],"id":"retry-policy","section_type":"decision","title":"네트워크 오류만 제한 재시도"},{"body":"한 행은 하나의 독립 scenario다. 행이 바뀔 때 persona와 history를 reset해 앞선 테스트의 style 상태가 다음 행을 오염시키지 않게 한다.\n\n한 행 안에서는 t1부터 tN까지 상태를 이어가므로 멀티턴 효과는 유지한다. 행 간 독립성과 행 내부 연속성을 동시에 보존한 데이터 규칙이다.\n","evidence_ids":["gemini-row-reset"],"id":"row-isolation","section_type":"decision","title":"XLSX 행마다 session reset"},{"body":"system prompt, request body, raw response, parsed result와 persona transition을 함께 기록한다. 최종 텍스트만 저장하는 방식보다 실패 당시 조건을 복원하기 쉽다.\n\n반대로 전체 호출 로그는 입력과 응답을 포함하므로 공개 자산이 아니다. 보관 기간, 마스킹과 접근 권한 정책을 정하기 전에는 외부로 내보내지 않는다.\n","evidence_ids":["gemini-session-state","gemini-json-recovery"],"id":"full-call-log","section_type":"decision","title":"요청과 응답 전체를 재현 로그로 사용"},{"body":"원본 XLSX runner는 model response를 파싱하고 prompt, request와 response 전체를 JSONL로 기록한다. 이 구현 근거가 보장하는 것은 재현 가능한 실행 흔적이며, expected output, judge와 pass/fail 품질 gate까지는 정의하지 않는다.\n\n따라서 이 프로젝트에는 현재 정확도 수치가 없다. 결과 파일 존재를 모델 품질 통과로 바꾸지 않는다.\n","evidence_ids":["gemini-no-quality-score"],"id":"validation","section_type":"validation","title":"실행 흔적과 품질 평가는 다름"},{"body":"fixed scenario manifest, 기대 state transition, judge rubric과 합격 목표가 필요하다. 자동 테스트와 live 재실행도 이번 작업에서 확인하지 않았다.\n\n현재 성과는 멀티턴 조건을 재현하고 사람이 편집할 수 있는 실행 스캐폴드다. 품질 승인은 별도 평가 계약을 추가한 뒤 가능하다.\n","evidence_ids":["gemini-no-quality-score","gemini-retry-policy"],"id":"limitations","section_type":"result","title":"다음 평가 계약"}],"summary":"REPL, JSON과 XLSX가 동일한 session state를 사용하고 persona 변화, 구조 복구와 전체 호출 로그를 남기는 실험 도구의 범위와 미정의 품질 gate를 정리한다.","title":"멀티턴 LLM 테스트 실행 구조"}
