{"decision_index":[{"decision_id":"bound-candidate-count","evidence_ids":["editorial-web"],"section_id":"bounded-selection","status":"adopted"},{"decision_id":"split-appearance-personality","evidence_ids":["editorial-web","editorial-server"],"section_id":"split-analysis","status":"adopted"},{"decision_id":"separate-search-and-selection","evidence_ids":["editorial-web"],"section_id":"bounded-selection","status":"adopted"},{"decision_id":"combine-results-automatically","evidence_ids":["editorial-server","editorial-web"],"section_id":"split-analysis","status":"adopted"},{"decision_id":"filter-search-to-people","evidence_ids":["editorial-server"],"section_id":"split-analysis","status":"adopted"},{"decision_id":"provide-structured-demo-fallback","evidence_ids":["editorial-server"],"section_id":"structured-fallback","status":"adopted"},{"decision_id":"create-curator-match-pack","evidence_ids":["editorial-server","editorial-web"],"section_id":"editorial-output","status":"adopted"},{"decision_id":"keep-matching-manual","evidence_ids":["editorial-docs","editorial-server"],"section_id":"manual-curation","status":"adopted"},{"decision_id":"collect-consented-applications","evidence_ids":["editorial-admin","editorial-server"],"section_id":"manual-curation","status":"adopted"},{"decision_id":"start-with-simple-admin-auth","evidence_ids":["editorial-server","editorial-docs"],"section_id":"manual-curation","status":"unresolved"}],"project_id":"260408-ideal-type-editorial","readiness":"ready","sections":[{"body":"이 도구는 여러 유명인 후보에서 선호 패턴을 찾고, 결과를 소개에 사용할 수 있는 문장과 이미지 콘셉트로 확장한다. 단순 랭킹보다 사용자가 어떤 외형과 성격을 따로 선택했는지 보존하는 것이 중요했다.\n\n분석 결과가 실제 사람 연결로 이어질 때는 동의, 책임과 연락 정보 운영이 생긴다. 그래서 모델이 자동으로 상대를 고르는 서비스가 아니라 운영자가 신청을 검토하는 수동 큐레이션 MVP로 범위를 제한했다.\n","evidence_ids":["editorial-narrative","editorial-server","editorial-docs"],"id":"planning-background","section_type":"planning","title":"선호를 한 점수로 줄이지 않기"},{"body":"한 번에 비교할 후보는 최소 3명, 최대 10명으로 제한했다. 후보가 너무 적으면 공통 선호를 찾기 어렵고 무제한이면 각 선택의 이유를 기억하기 어렵다. 수집량보다 비교 가능한 입력 범위를 택한 결정이다.\n\n검색 결과와 실제 선택 후보도 분리했다. 탐색 중 화면에 나타난 사람이 분석 입력에 자동 포함되지 않고, 사용자가 명시적으로 고른 후보만 다음 단계로 넘어간다.\n","evidence_ids":["editorial-web","editorial-server"],"id":"bounded-selection","section_type":"decision","title":"후보 선택을 3명에서 10명으로 제한"},{"body":"외모와 성격을 하나의 점수로 합치지 않고 별도 탭, 선택과 결과로 분리했다. 서로 다른 판단 근거를 같은 축으로 섞으면 사용자가 왜 결과가 나왔는지 설명하기 어렵기 때문이다. 두 분석이 모두 끝나면 종합 요약을 자동 생성해 사용자가 별도 병합을 반복하지 않게 했다.\n\n검색 후보는 사람으로 엄격히 필터링해 동명이인과 비인물 결과가 분석에 들어가는 위험을 줄인다. 필터 규칙은 구현돼 있지만 실제 검색 품질을 대규모로 측정하지는 않았다.\n","evidence_ids":["editorial-web","editorial-server","editorial-narrative"],"id":"split-analysis","section_type":"decision","title":"외모와 성격 분석을 별도 단계로"},{"body":"분석 결과는 화면이 안정적으로 소비할 수 있는 구조로 받는다. 외부 모델 설정이 없거나 호출이 실패할 때는 local 또는 demo 결과를 사용해 후보 선택부터 결과 화면까지의 UX를 계속 확인할 수 있게 했다.\n\nfallback은 실제 분석 품질을 대신하는 것이 아니다. 현재 환경이 어떤 모드로 동작하는지 서로 다른 기록이 일치하지 않아 운영 설정을 확정할 수 없고, 검색과 생성 품질도 별도 평가가 필요하다.\n","evidence_ids":["editorial-server","editorial-docs"],"id":"structured-fallback","section_type":"decision","title":"구조화 결과와 demo fallback"},{"body":"결과를 선호 설명 텍스트로 끝내지 않고 생성 초상과 Curator Match Pack으로 확장했다. 선택 근거, 종합 설명과 이미지 콘셉트를 한 묶음으로 만들어 운영자가 소개를 검토할 수 있게 했다.\n\n생성 초상은 실제 인물의 보증이나 매칭 성공 예측이 아니다. 분석 산출물을 편집 가능한 자료로 바꾸는 단계이며, 외부 생성 품질과 당사자 동의는 운영자가 별도로 확인해야 한다.\n","evidence_ids":["editorial-server","editorial-web","editorial-docs"],"id":"editorial-output","section_type":"decision","title":"분석을 소개 패키지로 확장"},{"body":"분석 결과만으로 사용자를 자동 연결하지 않는다. 신청 단계에서 표시명, 연락 방법과 동의를 받고 운영자가 큐레이션 큐에서 검토한다. 관리 화면은 신청 조회와 XLS 내보내기를 제공해 수동 운영을 지원한다.\n\n관리자 접근은 별도 계정 시스템 대신 단순 인증으로 시작했다. MVP 구현은 빠르지만 연락 정보의 암호화, 보존 기간, 삭제 요청, 다중 운영자 권한과 감사 로그가 충분하지 않다. 자동화를 피한 것만으로 개인정보 운영이 해결되는 것은 아니다.\n","evidence_ids":["editorial-server","editorial-admin","editorial-docs"],"id":"manual-curation","section_type":"decision","title":"자동 매칭 대신 운영자 검토"},{"body":"단일 Node 서버가 정적 사용자 화면과 관리자 화면, 검색, 분석, 이미지, match pack과 신청 API를 제공한다. 사용자 화면은 검색 후보와 선택 후보를 분리하고 외모와 성격 단계를 진행한다. 완료된 결과는 소개 패키지와 수동 신청으로 이어진다.\n\n런타임 데이터는 로컬 파일 중심이고 관리자 기능도 같은 서버에 있다. 작은 MVP에는 단순하지만 공개 운영의 접근 통제와 데이터 수명에는 별도 구조가 필요하다.\n","evidence_ids":["editorial-server","editorial-web","editorial-admin"],"id":"implementation-flow","section_type":"implementation","title":"선택에서 운영 큐까지"},{"body":"현재 서버, 사용자 화면과 관리자 화면의 JavaScript 문법을 확인했다. 구현 로그에는 과거 health 응답과 주요 endpoint를 호출한 기록이 있다. 자동 테스트와 현재 서버 전체 실행은 없다.\n\n외부 모델 설정에 관한 기록이 서로 달라 현재 운영 모드를 확정하지 않는다. 후보 검색 필터, 생성 초상, 신청 export와 실제 관리자 접근도 이번에 end-to-end로 실행하지 않았다.\n","evidence_ids":["editorial-docs","editorial-server"],"id":"validation","section_type":"validation","title":"현재 문법과 과거 endpoint 확인"},{"body":"표시명과 연락 방법, 동의 기록의 최소 수집, 암호화, 보존과 삭제 정책이 부족하다. 단순 관리자 인증은 공개 운영 강도로 충분하지 않고, 여러 운영자의 권한과 변경 감사도 없다.\n\n실제 검색과 생성 품질, 배포 환경 설정, 생성물의 적절성과 동의 절차도 확인되지 않았다. 현재 성과는 선호 선택과 분석을 수동 큐레이션 자료로 연결한 MVP이며 자동 매칭 서비스의 운영 승인이 아니다.\n","evidence_ids":["editorial-docs","editorial-narrative"],"id":"limitations","section_type":"result","title":"신청 데이터를 다루기 전의 과제"}],"summary":"후보 탐색, 외모와 성격 분석, 생성 초상과 소개 패키지를 단계로 나누고 자동 매칭 대신 동의 기반 운영자 큐레이션을 선택한 에디토리얼 MVP를 정리한다.","title":"선호 분석과 수동 큐레이션을 잇는 도구"}
