{"decision_index":[{"decision_id":"retain-annual-comparison-table","evidence_ids":["account-web","account-narrative"],"section_id":"planning-background","status":"adopted"},{"decision_id":"write-state-atomically","evidence_ids":["account-server"],"section_id":"atomic-json-store","status":"adopted"},{"decision_id":"ship-installer-and-portable","evidence_ids":["account-desktop","account-narrative"],"section_id":"windows-shell","status":"revised"},{"decision_id":"enforce-single-instance","evidence_ids":["account-desktop"],"section_id":"windows-shell","status":"adopted"},{"decision_id":"make-desktop-thin-shell","evidence_ids":["account-desktop","account-narrative"],"section_id":"windows-shell","status":"revised"},{"decision_id":"migrate-once-with-local-fallback","evidence_ids":["account-desktop","account-server"],"section_id":"migration-fallback","status":"adopted"},{"decision_id":"rename-positional-subtotals","evidence_ids":["account-web","account-narrative"],"section_id":"table-language","status":"revised"},{"decision_id":"collapse-hidden-months","evidence_ids":["account-web"],"section_id":"annual-table-state","status":"adopted"},{"decision_id":"expose-save-state","evidence_ids":["account-web"],"section_id":"annual-table-state","status":"adopted"},{"decision_id":"normalize-dropdown-interaction","evidence_ids":["account-web","account-narrative"],"section_id":"table-language","status":"revised"},{"decision_id":"fix-sticky-hit-order","evidence_ids":["account-web","account-narrative"],"section_id":"sticky-regression","status":"revised"},{"decision_id":"retain-premium-spreadsheet-direction","evidence_ids":["account-web","account-narrative"],"section_id":"visual-direction","status":"adopted"},{"decision_id":"infer-completion-from-actual-amount","evidence_ids":["account-web"],"section_id":"annual-table-state","status":"revised"}],"project_id":"260725-household-account-book","readiness":"ready","sections":[{"body":"이 가계부의 중심은 한 달의 거래를 자세히 분류하는 것이 아니라, 연간 계획 행과 12개월 실제 금액을 한 화면에서 비교하며 집행 상태를 확인하는 데 있다. 월별 카드 화면으로 전환하면 모바일 가독성은 좋아질 수 있지만, 어떤 비용이 매달 반복되고 어느 달에 초과했는지 가로로 비교하는 장점이 사라진다.\n\n그래서 표 구조를 유지한 채 입력, 저장 상태와 월 접기를 다듬고 Windows에서도 같은 화면을 쓸 수 있게 했다. 자동 은행 연동, 다중 사용자 계정과 회계 보고서는 초기 범위가 아니다.\n","evidence_ids":["account-narrative","account-web","account-server"],"id":"planning-background","section_type":"planning","title":"월별 화면보다 연간 비교 유지"},{"body":"연간 계획 행과 12개월 실제 금액을 같은 표에서 유지하고, 별도 완료 체크박스는 없앴다. 실제 금액이 입력됐다는 사실 자체를 집행 상태로 사용하며 예산 이내, 초과와 미입력을 서로 다르게 표시한다. 금액을 넣고 다시 체크하는 중복 동작을 줄이기 위한 선택이다.\n\n숨긴 월은 완전히 제거하거나 별도 설정 체크박스로 옮기지 않고 좁은 접힌 열로 남겨 같은 자리에서 다시 펼칠 수 있게 했다. 저장 버튼 문구도 명령만 보여 주는 대신 저장 중과 완료 상태를 전달하도록 바꿨다. 색 외의 보조 표현이 충분한지는 접근성 검증이 필요하다.\n","evidence_ids":["account-web","account-narrative"],"id":"annual-table-state","section_type":"decision","title":"금액 입력 자체를 완료 상태로 사용"},{"body":"Node 서버는 현재 예산과 월별 상태를 하나의 JSON으로 보존한다. 요청 크기를 제한하고 입력을 정리한 뒤 임시 파일에 먼저 쓰고 rename으로 교체해, 쓰기 도중 프로세스가 멈출 때 반쪽 파일이 남을 가능성을 줄였다.\n\n단일 문서는 구현과 이동이 단순하지만 여러 사용자의 동시 수정과 충돌을 해결하지 않는다. 원자 교체는 파일 단위 내구성을 높일 뿐 사용자 격리나 감사 이력을 제공하지 않는다.\n","evidence_ids":["account-server","account-narrative"],"id":"atomic-json-store","section_type":"decision","title":"단일 JSON을 원자 교체"},{"body":"웹과 Electron을 함께 제공하고 Windows에는 설치형과 포터블 패키지를 만들었다. 폴더 속 실행 파일만 전달하면 어떤 파일을 열어야 하는지와 업데이트 방법이 불명확해 설치형을 보완했고, 여러 번 실행해도 기존 창에 집중하도록 single-instance lock을 적용했다.\n\n이후 데스크톱 앱은 기능을 내장한 별도 제품보다 서버 화면을 여는 얇은 shell로 바뀌었다. 작은 UI 수정마다 새 설치 파일을 전달하는 비용을 줄이는 대신, 네트워크 상태와 원격 서비스의 데이터 경계가 더 중요해졌다.\n","evidence_ids":["account-desktop","account-narrative"],"id":"windows-shell","section_type":"decision","title":"웹 화면을 여는 얇은 Windows 앱"},{"body":"첫 실행 때 기존 로컬 상태를 원격으로 한 번 PUT하고 성공하면 원격 화면을 사용한다. 이관이 실패하면 사용자 데이터 위치에서 로컬 서버를 열어 작성한 항목을 잃지 않게 했다. 업데이트로 빈 기본값을 덮어쓰지 않는 것이 핵심 완료 조건이었다.\n\n이 흐름은 충돌 병합이 아니다. 원격에 다른 상태가 이미 있으면 어느 쪽이 더 최신인지 비교하지 않고 1회 전송이 덮어쓸 수 있다. 게다가 현재 원격 상태 API에는 사용자 격리가 없어 여러 사람이 같은 원장을 공유할 위험이 있다. fallback은 가용성을 높이지만 원격 오염을 해결하지 않는다.\n","diagrams":[{"alt":"기존 로컬 JSON을 Electron이 한 번 원격 상태 API로 전송하고 성공하면 원격 화면을 사용하며 실패하면 사용자 데이터 위치의 로컬 서버와 JSON으로 돌아가는 흐름","caption":"첫 실행의 로컬 상태 이관과 실패 시 로컬 서버 복귀 경계","id":"account-migration-fallback"}],"evidence_ids":["account-desktop","account-server","account-narrative"],"id":"migration-fallback","section_type":"decision","title":"기존 로컬 기록을 보존한 이관"},{"body":"`고정비 소계`와 `소계2`처럼 카테고리처럼 보이던 이름을 위치 기반 `중간 합계`로 통일했다. 이 행은 비용 종류가 아니라 표 안의 임의 구간을 합산하는 기능이므로 화면 용어를 실제 동작에 맞춘 수정이다.\n\n은행과 카드 선택도 입력 중심 Tab 순서, 서로 동시에 열리지 않는 dropdown, 외부 클릭 닫기와 선택 즉시 닫기로 정리했다. 표 안에서 반복 입력할 때 포인터로 메뉴를 매번 정리하지 않아도 되는 흐름을 목표로 했다.\n","evidence_ids":["account-web","account-narrative"],"id":"table-language","section_type":"decision","title":"위치 기반 중간 합계로 용어 통일"},{"body":"sticky 월 헤더가 예산 영역을 덮거나 중간 합계 추가선이 다른 행 위에서 눌리는 회귀가 있었다. z-index와 hit area를 재조정해 화면에 보이는 위치와 실제 클릭 대상이 일치하도록 했다. 단순한 시각 수정이 아니라 잘못된 행에 항목을 넣을 수 있는 입력 오류를 막는 변경이었다.\n\n표가 길어질수록 sticky 요소는 유용하지만 계층이 많아지면 포커스와 클릭 순서가 어려워진다. 다양한 zoom과 작은 화면에서의 회귀는 자동화돼 있지 않다.\n","evidence_ids":["account-web","account-narrative"],"id":"sticky-regression","section_type":"decision","title":"월 헤더와 삽입선의 겹침 수정"},{"body":"전체를 카드뷰로 바꾸는 방향보다 표의 비교 장점을 유지하는 `엑셀 프리미엄` 방향을 선택했다. 현재월 요약 카드, 절제된 상태색과 일관된 카테고리 표시를 보조로 추가하고 월 집중 보기는 별도 보조 아이디어로 남겼다.\n\n제품의 주 화면을 유행하는 카드 묶음으로 바꾸기보다 반복 입력과 연간 비교를 중심에 둔 결정이다. 다만 예산 상태를 색에 크게 의존하는 현재 표현은 색각과 고대비 환경에서 별도 검증이 필요하다.\n","evidence_ids":["account-web","account-narrative"],"id":"visual-direction","section_type":"decision","title":"카드 전환 대신 표의 가독성 개선"},{"body":"Node HTTP 서버가 정적 웹과 하나의 상태 API를 제공하고, 브라우저 앱이 연간 표를 렌더링한다. 저장은 정리된 JSON을 임시 파일과 rename으로 교체한다. Electron은 원격 URL을 우선 열고 기존 로컬 상태의 1회 이관을 시도한다.\n\n원격 연결이나 이관이 실패하면 Electron이 사용자 데이터 위치의 로컬 서버를 시작한다. 두 경로의 화면은 같지만 데이터 원장은 다를 수 있으므로 online과 offline 사이의 자동 병합을 제공한다고 설명하지 않는다.\n","evidence_ids":["account-server","account-web","account-desktop"],"id":"implementation-flow","section_type":"implementation","title":"서버 화면과 Electron의 역할"},{"body":"과거 작업 기록에는 Windows 설치형과 포터블 패키지 생성, 로컬 HTTP 응답과 원격 배포 성공이 남아 있다. 당시 패키지는 약 95MB였고 이관과 화면 회귀가 변경 범위별로 확인됐다.\n\n이번에는 서버, 브라우저 앱과 Electron 진입 파일의 문법만 확인했다. 실제 Windows에서 설치, single-instance, 업데이트, 원격 이관과 fallback을 다시 실행하지 않았고 자동 회귀 테스트도 없다. 과거 배포 기록은 현재 운영 주소나 데이터 안전성을 보증하지 않는다.\n","evidence_ids":["account-narrative","account-desktop"],"id":"validation","section_type":"validation","title":"과거 패키징과 현재 확인 범위"},{"body":"원격 상태 API에는 인증과 사용자 격리가 없어 여러 사용자가 같은 문서를 읽거나 덮을 수 있다. 1회 PUT은 충돌 해결이 아니며 원격 상태가 이미 있을 때 잘못 덮어쓸 위험이 있다. 이 문제를 해결하기 전에는 개인 재무 데이터의 운영 저장소로 볼 수 없다.\n\n코드 서명, offline과 online 전환, backup, 색각 접근성, 자동 테스트와 Windows 실제 기기 검증도 남아 있다. 확인된 결과는 연간 표를 웹과 Electron에서 공유하고 로컬 기록을 잃지 않도록 fallback을 둔 구현까지다.\n","evidence_ids":["account-server","account-desktop","account-narrative"],"id":"limitations","section_type":"result","title":"개인 가계부로 공개하기 전의 위험"}],"summary":"연간 계획과 월별 실제 금액을 같은 표에 유지하면서 웹 업데이트, Windows 실행, 로컬 데이터 이관과 실패 시 복귀를 함께 다룬 가계부의 결정과 위험을 정리한다.","title":"연간 예산을 한 화면에서 관리하는 가계부"}
