{"decision_index":[{"decision_id":"split-entity-and-action","evidence_ids":["semantic-retag"],"section_id":"entity-action-split","status":"adopted"},{"decision_id":"replace-rule-only-retagging","evidence_ids":["semantic-retag","semantic-retag-columns"],"section_id":"replace-rule-retagging","status":"revised"},{"decision_id":"preserve-stem-ending-surface","evidence_ids":["semantic-retag"],"section_id":"preserve-action-parts","status":"adopted"},{"decision_id":"define-action-type-contract","evidence_ids":["semantic-action-schema"],"section_id":"action-type-contract","status":"adopted"},{"decision_id":"stage-corpus-expansion","evidence_ids":["semantic-inventory","semantic-missing-dependency"],"section_id":"staged-corpus-pipeline","status":"adopted"},{"decision_id":"move-dictionary-ownership","evidence_ids":["semantic-transition"],"section_id":"split-asset-ownership","status":"adopted"}],"project_id":"semantic-verb-schema","readiness":"ready","sections":[{"body":"이 프로젝트는 음성 명령을 기능 토큰 하나에 바로 붙이는 작업에서 출발했다. 발화마다 엔티티와 동작 값을 채우면 표는 완성돼 보이지만, 규칙이 만든 값이 실제 한국어 표현을 얼마나 보존하는지는 설명하기 어려웠다. 같은 기능도 대상이 여러 개일 수 있고, 동사는 어근과 어미, 실제 발화 표면형이 달라 단일 정규화 값만 남기면 후속 사전과 모델이 다시 판단할 정보가 사라진다.\n\n그래서 목표를 빈칸 제거에서 언어 구조 보존으로 바꿨다. 기능 학습표를 엔티티 축과 액션 축으로 나누고, 형태소 분석과 후보 inventory를 독립 단계로 만들었다. 현재 저장소는 이 동사 학습 흐름만 소유하며, 사전과 리플레이 자산은 별도 전환 프로젝트로 이동한 상태다.\n","evidence_ids":["semantic-readme","semantic-retag","semantic-retag-columns"],"id":"planning-background","section_type":"planning","title":"완전 채움보다 재사용 가능한 언어 구조"},{"body":"첫 결정은 발화를 하나의 키워드 묶음으로 다루지 않는 것이었다. 무엇을 제어하는지 나타내는 엔티티와 무엇을 하려는지 나타내는 액션을 별도 열로 분리했다. 이 구조는 같은 대상에 실행·조회·조절이 붙는 경우와 같은 동작이 여러 대상에 쓰이는 경우를 구분하게 한다.\n\n다중 엔티티는 하나만 고르지 않고 구분자로 보존한다. 단일 대표값으로 축약하면 학습표는 단순해지지만 복합 발화가 가진 범위를 잃는다. 이 프로젝트는 후속 단계가 필요에 따라 좁힐 수 있도록 원래 단서를 먼저 남기는 쪽을 택했다.\n","evidence_ids":["semantic-retag","semantic-retag-columns"],"id":"entity-action-split","section_type":"decision","title":"엔티티와 액션을 별도 축으로 분리"},{"body":"초기 규칙 태깅은 빠르게 표를 채울 수 있었지만, 활용형과 문맥을 과도하게 정규화하는 문제가 있었다. 로컬 작업에서는 기존 결과를 되돌릴 수 있게 보존한 뒤 Kiwi 형태소 분석으로 재태깅하는 방향으로 전환했다. 명사·동사 품사와 기능명 seed를 함께 보고, 일반 명사와 범용 동사는 별도 stop 목록으로 걸렀다.\n\n형태소 분석기를 쓴다고 판단이 자동으로 정답이 되는 것은 아니다. 기능명에서 얻은 seed, 원문 명사, canonical verb map이 함께 개입한다. 따라서 이 선택은 수동 규칙을 없앤 것이 아니라, 규칙의 역할을 분석 결과를 보정하는 명시적 계층으로 옮긴 것이다.\n","evidence_ids":["semantic-retag","semantic-retag-columns"],"id":"replace-rule-retagging","section_type":"decision","title":"순수 규칙 태깅을 Kiwi 기반으로 교체"},{"body":"액션은 정규화된 어근만 저장하지 않았다. 활용 어미와 사용자가 실제로 말한 표면형도 별도 값으로 남겼다. 예를 들어 같은 켜기 의도라도 명령형, 부탁형, 구어체가 다르며, 이 차이는 사전 확장과 오인식 대응에서 중요한 근거가 된다.\n\n어근 하나로 통일하면 통계와 매핑은 쉬워지지만 원래 표현을 복원할 수 없다. 세 값을 분리하면 저장 구조는 늘어나도 후속 사전이 정밀 매핑과 일반화 규칙을 서로 다르게 설계할 수 있다. 이 프로젝트에서 가장 중요한 결과는 바로 이 정보 손실을 막은 것이다.\n","evidence_ids":["semantic-retag"],"id":"preserve-action-parts","section_type":"decision","title":"어근·어미·표면형을 함께 보존"},{"body":"액션 스키마는 실행, 수준 조절, 토글, 모드 선택, 상태 조회, 정보 질문, 예약, 권한, 취소, 선호 설정의 열 가지 유형을 정의한다. 단순히 동사 표면형이 같은지를 보는 대신 제품이 수행해야 할 행동의 성격을 구분하기 위한 계약이다.\n\n다만 현재 action type 파일이 존재한다고 해서 전체 function token 스키마가 완성된 것은 아니다. 관련 token YAML 일부는 비어 있어, 공개 결과는 액션 유형의 설계와 동사 학습 자산으로 한정해야 한다.\n","evidence_ids":["semantic-action-schema","semantic-readme"],"id":"action-type-contract","section_type":"decision","title":"동작을 열 가지 의미 유형으로 분류"},{"body":"대규모 말뭉치에서 바로 기능 후보를 확정하지 않고, 문서를 chunk로 나누고 동사 lemma 빈도를 집계한 뒤 기능 후보를 만들고 병합·의미 필터링하는 단계로 분리했다. 동사 inventory는 Kiwi 결과 중 동사·형용사 계열 lemma를 세어 JSON과 TSV로 내보낸다.\n\n단계 분리는 어디에서 후보가 늘거나 탈락했는지 추적하기 쉽다. 반대로 현재 후보 확장과 의미 필터 스크립트는 저장소에 없는 `fc_dict` 모듈을 참조한다. 설계된 흐름과 현재 단독 재실행 가능 상태를 구분해야 한다.\n","evidence_ids":["semantic-inventory","semantic-missing-dependency","semantic-readme"],"id":"staged-corpus-pipeline","section_type":"decision","title":"말뭉치 확장을 단계별 파이프라인으로 분리"},{"body":"프로젝트가 커지면서 동사 학습 스크립트, active dictionary, 리플레이 결과가 한 폴더에서 서로의 완료 상태를 가렸다. 2026년 4월 정리에서는 사전 JSON과 리플레이 평가를 Dictionary Transition Bundle로 옮기고, 이 저장소에는 동사 기반 학습과 평가의 시작점만 남겼다.\n\n이는 기능 통합이 아니라 책임 분리다. Semantic Verb Schema가 과거 사전 성능을 현재 자신의 결과로 주장하지 않고, 전환 번들도 의미 학습 코드를 소유한다고 주장하지 않는다. 두 프로젝트는 직접 이력이 있지만 독립된 저장소와 상태를 유지한다.\n","evidence_ids":["semantic-transition"],"id":"split-asset-ownership","section_type":"decision","title":"학습 데이터와 사전 평가의 소유권 분리"},{"body":"재태깅 스크립트는 학습 workbook을 읽고 기능명에서 seed를 만들며, 각 발화를 Kiwi로 분석해 엔티티와 액션 부분을 기록한다. 별도 inventory 스크립트는 말뭉치에서 VV·VA·VX 계열 lemma 빈도를 계산한다. 이후 후보 확장, 병합, 의미 필터 단계가 기능별 후보를 좁히도록 구성됐다.\n\n처리 방법과 데이터 원본도 분리했다. 공개 글은 어떤 단계와 기준을 사용했는지 설명하지만 학습 원문 전체를 공개 산출물로 옮기지 않는다. 재현 가능한 방법을 남기는 것과 원천 데이터까지 공개하는 것은 다른 결정이다.\n","evidence_ids":["semantic-retag","semantic-retag-columns","semantic-inventory"],"id":"implementation-flow","section_type":"implementation","title":"재태깅과 후보 생성의 구현 흐름"},{"body":"현재 확인 가능한 것은 action type 스키마, Kiwi 재태깅 코드, 동사 inventory와 후보 처리 스크립트가 존재한다는 사실이다. 재태깅 구현은 workbook의 entity, 어근, 어미와 표면형을 다시 쓰지만, 저장소에는 이를 보호하는 독립 테스트 스위트가 없다.\n\n과거 pseudo-gold 리플레이 수치는 사람이 확정한 정답 정확도와 같지 않다. 더구나 사전·리플레이 소유권이 이동했으므로 그 수치를 이 프로젝트의 현재 품질로 합치지 않는다. 현재 회귀 검증과 전체 파이프라인 재실행은 별도 gate다.\n","evidence_ids":["semantic-readme","semantic-missing-dependency","semantic-retag-columns"],"id":"validation-boundary","section_type":"validation","title":"과거 점검과 현재 재현성의 경계"},{"body":"이 프로젝트는 한국어 명령을 엔티티와 액션으로 분해하고 활용 정보를 보존하는 방법론과 구현 자산을 남겼다. 반면 비어 있는 token schema, 누락된 의존 모듈, 테스트 부재 때문에 저장소 하나만 받아 전체 과정을 재현할 수 있는 상태는 아니다.\n\n다음 단계는 누락 의존성을 명시적 패키지나 입력 계약으로 복구하고, 작은 고정 평가셋으로 재태깅 회귀를 검증하는 것이다. 그 전까지 완료 범위는 언어 구조와 처리 단계의 정리이며, 프로덕션 function calling 스키마 완성이나 최신 정확도 인증은 포함하지 않는다.\n","evidence_ids":["semantic-action-schema","semantic-missing-dependency","semantic-transition"],"id":"current-status","section_type":"result","title":"현재 상태와 남은 작업"}],"summary":"규칙으로 빈칸을 채우는 방식에서 벗어나 한국어 명령을 엔티티와 액션으로 분해하고, 형태소·활용형 정보를 후속 사전과 학습에서 다시 쓸 수 있게 보존한 과정을 정리한다.","title":"한국어 명령의 동사 의미 스키마 재구성"}
