{"decision_index":[{"decision_id":"split-three-operational-sources","evidence_ids":["hub-source-separation"],"section_id":"source-separation","status":"adopted"},{"decision_id":"separate-recommendation-playbooks","evidence_ids":["hub-source-separation"],"section_id":"source-separation","status":"adopted"},{"decision_id":"generate-tool-memory-adapters","evidence_ids":["hub-adapter-model"],"section_id":"adapter-generation","status":"adopted"},{"decision_id":"generate-skill-registry","evidence_ids":["hub-adapter-model"],"section_id":"adapter-generation","status":"adopted"},{"decision_id":"keep-v1-as-integrated-hub","evidence_ids":["hub-v1-scope"],"section_id":"v1-scope","status":"adopted"},{"decision_id":"keep-static-ui","evidence_ids":["hub-v1-scope"],"section_id":"v1-scope","status":"adopted"},{"decision_id":"replace-file-session-with-signed-cookie","evidence_ids":["hub-auth-revision"],"section_id":"auth-revision","status":"revised"},{"decision_id":"separate-usage-and-plan","evidence_ids":["hub-access-provider"],"section_id":"access-state","status":"adopted"},{"decision_id":"normalize-provider-errors","evidence_ids":["hub-access-provider"],"section_id":"provider-adapter","status":"adopted"},{"decision_id":"require-manual-review-on-update-failure","evidence_ids":["hub-updater-limit"],"section_id":"registry-updater","status":"adopted"}],"project_id":"260319-llm-tool-hub","readiness":"ready","sections":[{"body":"모델과 코딩 도구 추천, 프로젝트 상태, prompt 기능과 도구별 작업 규칙이 여러 파일에 흩어지면 어느 정보가 정본인지 알기 어렵다. LLM Tool Hub는 탐색과 실행 UI를 하나로 모으되 데이터 원본은 역할별로 분리했다.\n\n이 프로젝트에서 만든 memory profile은 당시 여러 도구 adapter를 생성하기 위한 원본이다. 현재 workspace 전체의 자동 memory와 같은 권한을 갖는 전역 저장소는 아니다.\n","evidence_ids":["hub-source-separation","hub-adapter-model","hub-memory-boundary"],"id":"background","section_type":"planning","title":"흩어진 도구 정보를 하나의 운영 표면으로"},{"body":"모델과 도구 사실은 registry, 프로젝트 상태는 project registry, 공통 작업 방식은 normalized memory profile이 소유한다. 한 파일이 모든 사실을 중복 보관하지 않는다.\n\n추천 playbook도 registry 설명과 분리한다. 제품 사실이 바뀌는 일과 특정 업무에 어떤 조합을 권장하는 규칙이 바뀌는 일을 독립적으로 관리한다.\n","evidence_ids":["hub-source-separation"],"id":"source-separation","section_type":"decision","title":"운영 데이터 정본을 세 영역으로 분리"},{"body":"AGENTS, Claude, Gemini, Cursor와 Windsurf용 파일을 각각 수기 수정하지 않고 normalized profile에서 생성한다. 설치 skill registry도 현재 scan 결과에서 파생한다.\n\n복사본 불일치를 줄이는 구조지만 원본이 오래되면 모든 adapter가 같은 오류를 복제한다. adapter 생성 성공과 정보 최신성은 별도 gate다.\n","evidence_ids":["hub-adapter-model","hub-stale-registry"],"id":"adapter-generation","section_type":"decision","title":"도구별 memory 파일을 파생물로 관리"},{"body":"초기 범위는 workflow builder와 복잡한 조직 협업보다 모델·도구 탐색, 로그인, 개인화와 prompt 재사용에 집중했다. 정적 HTML·CSS·JavaScript UI를 유지하고 서비스 호출만 Python server가 처리한다.\n\n더 큰 자동화 플랫폼을 먼저 만드는 대신 현재 기능의 인증과 데이터 경계를 확인할 수 있는 작은 운영 허브를 선택했다.\n","evidence_ids":["hub-v1-scope"],"id":"v1-scope","section_type":"decision","title":"V1은 탐색과 운영 안정성 우선"},{"body":"서버 파일에 session 상태를 쌓는 방식에서 서명 cookie 기반 stateless session으로 교체했다. 배포 인스턴스와 로컬 파일 상태가 어긋나는 문제를 줄이고 인증 검증을 요청 경계로 옮겼다.\n\n이전 방식은 Git 이력으로 돌아갈 수 있지만 현재 운영 계약은 signed cookie다. 실제 배포의 cookie 보안 속성과 OAuth flow는 별도 live 확인이 필요하다.\n","evidence_ids":["hub-auth-revision"],"id":"auth-revision","section_type":"decision","title":"파일 session에서 signed cookie로 변경"},{"body":"로그인 여부, 무료 사용량, 유료 plan과 prompt 실행 권한을 한 boolean으로 합치지 않는다. 사용자는 로그인했지만 quota가 없을 수 있고, plan이 있어도 provider 설정이 없을 수 있다.\n\n상태를 분리해 UI가 막힌 이유를 설명하고 server가 각 경계를 별도로 검사할 수 있게 했다.\n","evidence_ids":["hub-access-provider"],"id":"access-state","section_type":"decision","title":"로그인, 사용량과 plan 분리"},{"body":"여러 provider의 요청 형식을 adapter로 감싸 Prompt Tailor와 Translate 같은 공통 기능에서 호출한다. provider 오류는 내부 예외나 비밀값 대신 일반화된 사용자 메시지로 바꾼다.\n\nadapter는 연결 형식을 통일하지만 결과 품질을 통일하지 않는다. provider별 fixed eval은 없어 어느 모델 조합이 더 낫다는 품질 결론은 내리지 않는다.\n","evidence_ids":["hub-access-provider"],"id":"provider-adapter","section_type":"decision","title":"provider 차이를 공통 prompt 기능 뒤로"},{"body":"updater는 일부 공식 source의 version 패턴을 확인하고 일치하면 상태를 갱신한다. source 실패나 불일치는 파일 전체를 조용히 성공시키지 않고 needs_manual_review로 남긴다.\n\n정규식 존재 확인은 가격, 스펙과 사용 가능성을 모두 검증하지 못한다. 자동 확인 범위를 넘는 항목은 사람이 검토해야 한다.\n","evidence_ids":["hub-updater-limit"],"id":"registry-updater","section_type":"decision","title":"자동 갱신 실패를 manual review로 남김"},{"body":"현재 model/tool registry의 generated_at은 2026년 3월 19일이다. 현재 시점의 공식 정보로 다시 검증한 기록이 없으므로 최신 허브라는 기준을 통과하지 못한다.\n\nskill registry와 memory profile도 3월 생성본이므로 현재 설치 상태와 자동 memory 구조의 정본으로 사용하지 않는다. registry stale 상태를 명시적인 below-gate로 남긴다.\n","evidence_ids":["hub-stale-registry","hub-memory-boundary"],"id":"stale-registry","section_type":"validation","title":"현재 registry는 오래된 상태"},{"body":"프로젝트 내부 normalized memory는 이 허브가 여러 도구 파일을 만드는 데 사용한 설계 자산이다. 현재 workspace의 user-wide memory를 덮어쓰거나 다음 Codex 대화에 자동 적용하지 않는다.\n\n과거 프로젝트의 global_memory라는 이름을 실제 전역 권한으로 해석하지 않고, finished-project 내부 artifact로 한정한다.\n","evidence_ids":["hub-memory-boundary"],"id":"memory-boundary","section_type":"decision","title":"당시 adapter 원본과 현재 전역 memory 구분"},{"body":"registry currentness, 프로젝트 목록 동기화, 인증·quota·provider 회귀 테스트와 public deployment를 다시 확인해야 한다. package script에서 자동 테스트도 확인되지 않았다.\n\n현재 성과는 정본과 adapter를 분리한 운영 구조다. 최신 추천 서비스나 현재 전역 memory 시스템으로 승인된 상태는 아니다.\n","evidence_ids":["hub-stale-registry","hub-updater-limit","hub-memory-boundary"],"id":"limitations","section_type":"result","title":"재가동 전에 필요한 점검"}],"summary":"모델·도구·프로젝트 registry와 normalized memory를 분리하고 도구별 adapter를 생성한 허브의 구조, 인증 변경과 오래된 registry 한계를 정리한다.","title":"LLM 도구와 메모리 어댑터 운영 허브"}
